Question,ID
OS X keybindings in AIR app,205841
Integrated Security for multiple domains?,205840
windows automatic software updates,205830
Odd permissions on file modified by PHP move_uploaded_file(),205822
How does sharepoint recognize a file type?,205808
Phalanger with cakephp [closed],205807
Are there any recommendations for tools for remote collaboration on Windows? [closed],205800
How to convert a SqlServer DateTime to universal time using SQL,205797
How to move scroll bar up by one line? (In C# RichTextBox),205794
Rails: Best way to make changes to a production database,205793
YUI DataTable .NET webservice,205783
How to fix code-complete in Visual Studio 2008,205782
How do I implement an address location bar (bread crumb control) similar to that in Windows Vista's File Explorer?,205775
How to add XAML storyboard animation to a full blown WPF Custom Control in an XBAP?,205751
Java XML Binding [closed],205749
Get list of all tables in Oracle?,205736
Read and write from/to a binary file in Matlab,205735
asp.net hyperlnk control,205733
How do I populate the selected value of drop down lists with Mysql data? [duplicate],205731
What are the key use cases for use of virtualization in software development?,205722
Using Ext JS in ASP.NET [closed],205720
LINQ External Mapping to Class Library,205711
How can I check the syntax of Python code in Emacs without actually executing it?,205704
Matching values in two tables query (SQL and ColdFusion),205697
"New automatic properties in c# 3.0, what's the benefit? [duplicate]",205691
Class with single method -- best approach?,205689
JavaScript Exception Handling,205688
Having trouble getting MSBuild and MSBuildCommunityTasks (VSS) to work together,205676
Copying file security permissions,205668
What is the Best Way to Perform Timestamp Comparison in Bash,205666
"Best pattern for simulating ""continue"" in Groovy closure",205660
Error when using extension methods in C#,205644
SharePoint (MOSS) hosting with custom code allowed,205635
Javascript - loading/busy indicator or transparent div over page on event click,205631
Iterate through a contacts properties using outlook,205624
How to change MySQL root password to default?,205614
Are all pages within an ASP.Net application ran in the same appdomain?,205601
"How can I use Visual Studio's ""Code Snippet"" feature while editing a .aspx file?",205594
sql server 2005 attach database broken,205583
How do you use querystrings with ASP.NET routing?,205582
"At runtime, find all classes in a Java application that extend a base class",205573
Have trivial properties ever saved your bacon?,205568
How do you organise your ATG projects?,205557
The most sophisticated way for creating comma-separated Strings from a Collection/Array/List?,205555
XML From a Web Service Call,205546
Why does a deleted file reappear in Vista?,205538
Passing variable number of arguments around,205529
how to use google feed api to detect feeds updates,205527
How do I create a stored procedure that will optionally search columns?,205526
openGL SubTexturing,205522
