Question,ID
Turning C# methods into C++ methods,197606
Uploading and Downloading Comparison using WebRequest & Sockets,197603
Exception handling practices,197593
What are best fit patterns to use when developing VSX Package or Isolated Shell Package?,197589
What real-world projects would you suggest as code examples to study?,197571
What is the simplest way to charge money over the Internet? [closed],197525
Best way of using List<T> and exposing Collection<T>,197521
Can I create a single VB6 OCX with multiple controls?,197518
How to use Data Access Objects for serialized & relational database data access,197509
PHPs mime_content_type() fail on windows,197508
How do I determine number of window handles an application is using?,197497
jQuery drag and drop - how to get at element being dragged,197489
When to use a new exception type,197482
JPA and Hibernate - Criteria vs. JPQL or HQL,197474
Does ATL/WTL still require the use of a global _Module variable?,197468
What's a good templating system for PHP? [closed],197466
"What is the difference between ""VC++"" and ""C++""?",197461
What navigation control would you choose to use in your application?,197460
Why are Wemf and Google Analytics telling me so different things?,197459
How to find all dependencies of a .NET project?,197447
Building libcurl with SSL support on Windows,197444
MATLAB error: Undefined function or method X for input arguments of type 'double' [duplicate],197441
When should I call Naming.unbind()?,197421
Changing the upload limit in php,197419
Handle errors with ErrorController rather than a direct view,197414
Enterprise Library Database Trace Listener?,197410
Define a calculated member in MDX by filtering a measure's value,197407
Generate User Specific 1 Time Coupon Code,197388
Docstrings for data?,197387
Locating bundles by identifier,197383
Optimizing single-row queries from large tables in MySQL,197381
How do I create a symlink in Windows Vista?,197379
"Visual c++ ""for each"" portability",197375
Parameterized test case classes in JUnit 3.x,197372
Library of Useful (Difficult) SQL scripts [closed],197369
VS Setup Project: Uninstall other component on install,197365
Select products where the category belongs to any category in the hierarchy,197362
ASP.NET Forms Authentication With Only UserName,197357
How to Integrate PHPList with the Existing Site,197353
Flash Organisation Chart [closed],197345
Getting DNS servers on Windows,197344
"Kohana PHP, ORM and MySQL BLOBs",197319
Design question: How can I access an IPC mechanism transparently?,197310
Best way to search in a varchar column in sql server,197307
local rails on Mac OSX loses connection to mysql,197304
How to unset variable in C#?,197302
How do you design an enumerator that returns (theoretically) an infinite amount of items?,197297
LINQ Issue: Unable to cast object of type 'System.Reflection.Module' to type 'System.Reflection.Emit.ModuleBuilder,197294
Grouping by intervals,197291
"Virtual 360º, stitching and presentation software, for use on PHP driven website?",197290
