Question,ID
What are some of the advantage/disadvantages of using SQLDataReader?,192599
How to send an email attachment with signature in excel,192592
How can I set different Tooltip text for each item in a listbox?,192584
TFS Webservice Documentation,192579
Transfering User Names from One Forum to Another?,192575
Firefox 'Error loading script' loading Google Analytics in FF2,192570
Is there a Visual Studio plugin for sorting build output (scrambled from multi-threaded builds)?,192561
ASP.net MVC custom string output overloaded operator <%=h,192553
How can I use different RJS templates from the same rails controller?,192549
Is this the right approach for structuring codebase?,192546
Is there a way to change the name of a Start menu link name using a Custom Action,192545
IP Address change with limited account,192544
Use asynchronous delegates or ThreadPool.QueueUserWorkItem for massive parallelism?,192539
"In the hCalendar microformat, what markup is allowed in a description?",192538
What are the advantages of memory-mapped files?,192527
"trac and svn (tortoise) - ""Issue Tracker Plugin"" - ( yes, yet another svn and trac question)",192502
Getting a useful report from SVN - non-code files messing the stats up [closed],192484
Connecting to Informix database from .Net,192477
How to localize ASP.NET MVC application? [duplicate],192465
Improving really bad systems,192464
Setting a log file name to include current date in Log4j,192456
How can KDiff3 be used properly with TortoiseSVN to resolve conflicts?,192454
"Using new Groovy Grape capability results in ""unable to resolve class"" error",192432
improved collection Iterator,192417
How do you prevent a RichTextBox from refreshing its display?,192413
Good explanation/documentation on ftrace,192401
Select XML nodes as rows,192398
Rails: page protection redirection problem with link_to_unless_current,192375
Force Garbage Collection in AS3?,192373
In Django how do I notify a parent when a child is saved in a foreign key relationship?,192367
How to grab AD credentials from client machine in a web application?,192366
Pylons with Elixir,192345
Is there a way in .NET to have a method called automatically after another method has been invoked but before it is entered,192332
Simple WPF sample causes uncontrolled memory growth,192329
How do I know the script file name in a Bash script?,192319
Application window sent behind other windows on closing different thread (C#),192313
How to write to the console in a GUI application,192294
How best to include other scripts?,192292
SSL Certificate encryption vs cypher encryption,192268
Asp.Net Static method to refresh page,192264
How do I log an exception at warning- or info-level with traceback using the python logging framework?,192261
Calculating a date around working days/hours?,192260
Where to put extra functionality for the database layer (Linq-to-SQL),192256
How do I parse command line arguments in Bash?,192249
Issue with database connection from sharepoint workflow with integrated security options,192241
Why does declaring content as a string cause WinHttp to not send HTTP content in Excel VBA?,192238
Is it possible to define a property on a WPF user control is required?,192237
table-based forms?,192232
Parse and replace a BBCode [youtube] placeholder,192228
What is the most efficient way to parse a flat table into a tree?,192220
