Question,ID
How to inflate a file with zlib.NET?,185690
How to parse the DOM and determine what row is selected in an ASP.NET ListView,185681
Javascript nested class,185680
User Persistence: asp.net caching:,185679
How do I sync application data between an iPhone and another computer?,185673
Templated ASP.NET user control,185664
RFC timestamp in Flash/AS3,185661
How to scale a UIImageView proportionally?,185652
Dispose of Image in WPF in Listbox (memory leak),185648
Optimizations for a Write heavy Oracle application?,185638
"Query Analyzer VS. Query Profiler Reads, Writes, and Duration Discrepencies",185634
What happens to static variables in inline functions?,185624
SharePoint and Enterprise Library 4.0,185621
"page Preinit, Init, load",185609
Insert array into database in a single row,185606
how to structure data for searchability,185597
Java Generics Syntax for arrays,185594
"Understanding the ""cannot find symbol"" error",185591
Dynamic (?) parser,185584
Powershell equivalent of bash ampersand (&) for forking/running background processes,185575
What is mattr_accessor in a Rails module?,185573
Fetching Minimum/Maximum for each group in ActiveRecord,185569
Updating OpenLDAP using a Java class,185563
Remove domain information from login id in C#,185559
.NET logging framework [closed],185542
"In openGL, how can you get items to draw back to front?",185536
Largest Heap used in a managed environment? (.net/java),185535
How does the DropBox Mac client work?,185533
Java: AWT on Solaris [closed],185531
Building MFC Automation example (to access Excel using OLE automation). Can't compile,185524
Generate View for iPhone application using interface builder.?,185523
Actionscript3 E4X XML and CSS: Do I really have to use CDATA?,185522
What other objects are accessible inside <%# %> tags in aspx?,185521
Convert Month Number to Month Name Function in SQL,185520
How can I concatenate regex literals in JavaScript?,185510
Return values from different tables based on a priority,185487
Which Eclipse Subversion plugin should I use?,185486
Prevent direct access to a PHP page,185483
AIR Caching framework/library,185479
"Determine if swf is in a ""debug"" player or mode",185477
C# Retrieving correct DbConnection object by connection string,185474
What's the best way to handle landscape/portrait differences in IB?,185463
Reading input m-file in a main m-file,185461
Quick-and-dirty way to ensure only one instance of a shell script is running at a time,185451
Would you consider this a singleton/singleton pattern?,185448
Should I just move the file or create a class which moves it?,185447
FileLoadException on windows 2003 for managed c++ dll,185445
"Why is MPI considered harder than shared memory and Erlang considered easier, when they are both message-passing?",185444
Why is Eclipse deleting my files and putting them in 'Local History'!,185442
How to use JSON to create object that Inherits from Object Type?,185429
