Question,ID
How can I delete (not disable) ActiveX add-ons in Internet Explorer (7 and 8 Beta 2)?,180624
How do I convert a list of ascii values to a string in python?,180606
"Using ""super"" in C++",180601
Does anyone have experience with ZFS? [closed],180586
What is the best practice in defining a soap service (generic vs. specific operation)?,180572
Bold text for a tab control,180563
Learn C first before learning Objective-C [closed],180549
SQL Express for production?,180537
Best way to access Java classes from C++? (better than using JNI directly),180528
Single-row subqueries in Oracle -- what is the join plan?,180518
How to filter items from a std::map? [duplicate],180516
Display an invalid default value in a DataGridViewComboBoxColumn,180511
Is there a master list of the Big-O notation for everything?,180510
MOSS 2007 Document Library - choice column not displaying selected value,180498
Obtaining MP3 Audio Compression Library,180471
How do you deal with connection strings when deploying an ASP.NET site?,180470
What's the proper use of php.ini's session.save_path?,180464
How do I set a click event for a form?,180452
"Using javascript and jquery, to populate related select boxes with array structure",180451
Mixed syntax for control structures generating syntax errors,180430
Create Generic List from a subclass,180428
LINQ inner join betwenn Enumerable and DB Table,180422
Sharepoint InputFormSection control look-a-like,180415
Mocks or real classes? [duplicate],180413
What does the setting WorkArounds2=8192 do on an ODBC connection?,180412
How do you add dynamic 'where' clauses to a linq query?,180405
Placement of the asterisk in pointer declarations,180401
Can I make JUnit more verbose?,180398
"C# Abstract class, using anonymous instead of declaring concrete class?",180397
Is there any way instead of a JS hack where I can post from an iframe to another page outside the iframe?,180373
"Enforce the use of the ""this"" and ""base"" at compile-time in Visual Studio/C#",180371
How to display DateTime with an abbreviated Time Zone?,180370
Losing Button.Click events after first partial postback in UpdatePanel,180366
How do you open a hxs file?,180365
C# WinForms UserControl Mouse Event Help,180363
Delphi versus C++ Builder - Which is Better Choice for a Java Programmer Doing Win32 [closed],180358
How can I dynamically change the Active Record database for all models in Ruby on Rails?,180349
Is it a good idea to use Active Directory user login to your application,180343
Obtain file path of C# save dialog box,180330
Updateable (and persistable) dataset based on a join - possible with ADO.Net?,180328
Equation Solvers for linear mathematical equations,180327
Excel automation via OLE - suppressing / catching dialog box errors?,180324
Are C++ Templates just Macros in disguise?,180320
Can Delphi 2009 in English and in French coexist on the same machine?,180299
What are your Java 'rules'?,180297
Get the Primary Key of a new Entry,180295
How do I POST from an iframe to another page outside the iframe?,180294
What are the limits of ruby on rails?,180290
DataReader or DataSet when pulling multiple recordsets in ASP.NET,180283
Change Windows Mobile 6.1 Theme Programmatically,180277
