Question,ID
Should a developer aim for readability or performance first? [closed],183201
Ruby rufus scheduler gem,183191
"C wrapper to remove users on command ""ps""",183190
UserType join in Hibernate,183185
How do I fade a row out before postback,183179
How to break from nested loops in JavaScript?,183161
What is the appropriate amount of error-checking?,183158
Visual Studio and Virus Scan of Temp folder,183153
Stored Procedure Versioning,183148
How do you decide if something goes in the view or the controller? (Zend Framework),183131
Multiple random values in SQL Server 2005,183124
Windows Forms: Screen capture when running non-graphically (i.e. screensaver is active),183118
How to disable all apache virtual hosts?,183115
'Un-SVN' a working copy,183114
How do I play background music in my iPhone game? [duplicate],183112
Is object code generated for unused template class methods?,183108
MFC List Control scrolling shows extra grid lines,183101
"Vb6 ""Tag"" property equivalent in ASP.Net?",183093
Capistrano for Java?,183091
How to determine if the application is an MFC program?,183086
Need help writing a custom BuildListener,183083
How to fetch value from another row within the same data pipleline?,183078
Is there a hotkey to speed up the repetitive commits in Eclipse (or a general windows GUI macro tool)?,183075
"How do I customize the behavior of ""cut"" in Eclipse?",183071
CSS 'schema' how-to [closed],183062
How can I use UUIDs in SQLAlchemy?,183042
Graphing/Crystal Reports with ASP.Net MVC,183041
Current Cursor Position when Using the Prawn Ruby Library,183039
WPF ComboBox doesn't stay open when used in a Task Pane,183035
Improve speed performances in C#,183033
Send a list of IDs to a SQL Server stored procedure from c#,183032
Drop-shadows text: CSS or graphic?,183024
Discover what process/query is using the oracle SGA,183021
How to read sql_variant database type in C#,183018
Removing Cache Busting in Rails Production,183017
Using top clause in Access sub report,183016
Hibernate: comparing current & previous record,183013
C# Google Earth Error,183009
How to get a reference to a table row with a specific value in jQuery,183004
Protect Excel Worksheet for format and size and allow only for entry,183002
Build C project automaticly,183001
ASP.NET MVC in a virtual directory,182993
How to draw ARGB bitmap using GDI+?,182988
ASP.NET- Instantiate a Web User Control in App_Code class,182984
"What is more efficient for parsing Xml, XPath with XmlDocuments, XSLT or Linq?",182976
Static library - visual studio 2005/6.0 compatibility,182965
Position in Vector using STL,182957
"How to see what will be updated from repository before issuing ""svn update"" command?",182945
In an Oracle cluster will sysdate always return a consistent answer?,182931
"How to write an automatic ""copy, check-out, change and check-in""-script for svn",182928
