Question,ID
Is there a way to prevent a SystemExit exception raised from sys.exit() from being caught?,173278
"C#/.NET, what to look at?",173272
Direct3D Camera aspect ratio/scaling problem,173269
Hooking syscalls from userspace on Windows,173265
Apache POI HWPF - Output a table to Microsoft Word,173260
Example code for Resizing an image using DirectX,173258
"Writing ID3v2 Tag parsing code, need Good examples to test",173257
How can I make my ad hoc iPhone application's icon show up in iTunes?,173247
"Parsing and generating Microsoft Office 2007 files (.docx, .xlsx, .pptx)",173246
How to continue executing other processes in command line window after breaking a running process using C#,173242
What library should be included to use TransparentBlt?,173241
What Could Cause Intermittent Issues with Images Loading in Internet Explorer 6?,173224
php-cgi runs as root,173219
mysql_real_escape_string() leaving slashes in MySQL,173212
How do I connect to an .mdf (Microsoft SQL Server Database File) in a simple web project?,173209
JQuery's $ is in conflict with that of StringTemplate.Net in ASP.Net MVC,173207
Getting color of a data series from a flot chart,173205
Can someone explain per-pixel collision detection?,173199
Difference Between ViewData and TempData?,173159
How do you stay focused and ship projects? [closed],173158
Removing border/background from Crystal Report Viewer in Visual Studio 2008,173149
conditional logic based on type,173145
What's the best way to only allow a PHP file to be included?,173144
How to reinterpret cast a float to an int? Is there a non-static conversion operator or user-defined assignment operator for conversion on 'this'? [duplicate],173133
mootools or javascript : what does $tmp stand for or what does it pertain too,173115
Election 2008 data files - how to know which candidate received the financial contribution?,173108
Custom Date Formatting in J2ME,173085
C# .NET 3.0/3.5 features in 2.0 using Visual Studio 2008,173080
"Flash/Actionscript2 - Can't get comboBox ""change"" event to fire",173079
2.9999999999999999 >> .5?,173070
"Does anyone write really long, complex PHP apps? [closed]",173057
parameterised jsp:includes of stripes actions?,173056
Is there a simple JavaScript slider? [closed],173046
NOT IN vs NOT EXISTS,173041
Can anyone think of some good reasons *not* to use an Object-Oriented DBMS to back a website?,173040
Ghostdoc-like plugin for IntelliJ IDEA,173018
Why log4j cannot generate backup files?,173017
How do you make a WPF slider snap only to discrete integer positions?,173009
Apache: Multiple log files?,173008
Converting mysql TIME from 24 HR to AM/PM format,173005
Detecting Back Button/Hash Change in URL,172957
hashing sensitive data,172951
Add (external) relationship (tagging) to existing Hibernate entities,172950
Oracle Cursor Issue,172948
Creating a winforms app that allows drag and dropping of custom 'widgets',172946
PHP Libraries: SVN Access,172945
In Microsoft Visual Studio 2005 is it possible to set the size of an edit window when opened?,172944
Implementation of ISupportErrorInfo - what does it mean?,172942
Executing code stored as a list,172935
Displaying an IGrouping<> with nested ListViews,172934
