Question,ID
Logging conventions [closed],163385
Type mismatch for Class Generics,163382
Error Updating a record,163367
How do I make a C++ macro behave like a function?,163365
How to setup VS2008 for efficient C++ development,163364
How do I create an Excel chart that pulls data from multiple sheets? [closed],163363
Regular expression to match URLs in Java,163360
Subquery in an IN() clause causing error,163355
How do I read all feed items?,163342
Isolate a single column in a multi-dimensional array,163336
Weird results using P4COM,163313
Best Way To Get All Dates Between DateA and DateB,163311
How do I ignore a directory in mod_rewrite?,163302
Textarea overflow-x when a user copy-pastes into it?,163294
What do you need to take into consideration when deciding between MySQL and Amazon's SimpleDB for a RoR app?,163275
"On 32-bit CPUs, is an 'integer' type more efficient than a 'short' type?",163254
SQL Server equivalent to Oracle's CREATE OR REPLACE VIEW,163246
Where can I find a List of Standard HTTP Header Values?,163236
How do I test if a given BSP tree is optimal?,163225
How do I use a String as a Stream in .Net?,163207
IIS6: 503 errors and CPU spikes,163192
VERY slow running regular expression when using large documents,163184
LINQ to SQL Peculiarities,163183
IIS Connection Pool interrogation/leak tracking,163164
Can you call Directory.GetFiles() with multiple filters?,163162
Where is the best place to re-learn graphics programming,163146
Breakpoint not hooked up when debugging in VS.Net 2005,163133
Can CLIENT-CERT auth-method be used with a JDBC realm within tomcat?,163113
How do I grab events from sub-controls on a user-control in a WinForms App?,163104
How do I shrink the transaction log on MS SQL 2000 databases?,163098
Setting default values (conditional assignment),163092
Exporting from SQLite to SQL Server,163079
"Coupling, Cohesion and the Law of Demeter",163071
How can I detect if I'm compiling for a 64bits architecture in C++,163058
High resolution timer in .NET,163022
Where can I find free content hosting? [closed],163021
urllib2 file name,163009
MySQL Query: LIMITing a JOIN,163004
The RunInstaller attribute in a WMI provider assembly,162993
Selecting proper toolkit for a 2D simulation project in Java,162991
Dynamically Load Embedded Resource Report Using Microsoft.Reporting.WinForms,162989
Including arrary index in XML Serialization,162986
Eclipse RCP Splash Screen,162985
SWT Link flickers with gradient background,162969
Why do I get an error after closing my Windows Forms application?,162962
Is there a source-control system that allows tracking of file name changes?,162960
Why use pointers? [closed],162941
Would it be possible to use web services from a Cobol program?,162940
Readonly ComboBox in WinForms,162936
Formatting a field using ToText in a Crystal Reports formula field,162931
