Question,ID
How do I resolve merge conflicts in a Git repository?,161813
"Is one's complement a real-world issue, or just a historical one?",161797
How do I send arrays between views in CakePHP,161794
initialize a const array in a class initializer in C++,161790
"Are there any downsides to passing structs by value in C, rather than passing a pointer?",161788
"Is JavaScript single threaded? If not, how do I get synchronized access to shared data?",161783
What is the best MemCache solution for ASP.NET applications? [closed],161782
php - imap - moving emails on antoher account,161775
Putting configuration information in a DLL,161763
How would you implement ant-style patternsets in python to select groups of files?,161755
How to allow MediaWiki logged user to edit Common.css?,161747
What is the best regular expression to check if a string is a valid URL?,161738
What are the best ASP.NET performance counters to monitor? [closed],161737
Adding and removing content in jQuery,161717
How to remotely Start/Stop SQLServer services kicking off existing connections?,161715
What is the size limit of the application object in classic asp?,161712
Using Generic lists on serviced component,161704
How can I speed up my maven2 build?,161698
Best Linux Distro for Web Development? [closed],161697
Perl Challenge - Directory Iterator,161687
"GWT Table that supports sorting, scrolling and filtering",161686
iCalendar Format (Outlook 2007),161677
Home/End keys in zsh don't work with putty,161676
C++ class initialisation containing class variable initialization,161672
SICP Exercise 1.3 request for comments,161666
How can I maintain history of a file that is moved to a directory overwriting a file of the same name,161655
Truncating Method calls,161654
Windbg: How to set breakpoint on one of the overloads of a C++ function?,161639
Visual Studio 2005 - can not open form on designer,161637
Should methods in a Java interface be declared with or without a public access modifier?,161633
Why is Apache + Rails is spitting out two status headers for code 500?,161631
How do you get the Class of an Abstract class (Object) in JavaME?,161614
Usability: Should the ENTER key close a wizard form as OK even if the focus is not set on the OK/DONE button?,161591
How do I launch a standalone SWF from within an Adobe AIR application?,161570
"Convert IDictionary<string, string> keys to lowercase (C#)",161556
Programmatically renaming a table in SQL Server 2000 - is sp_rename the only solution?,161549
AJAX Toolkit - AJAX Framework,161543
Should I use SVN or Git? [closed],161541
Where is GDB documentation specific to the Cell Linux environment?,161540
What's the purpose of instance methods in Modules without classes?,161539
Submitting a form on a user control by pressing enter on a text field does not work,161531
"is there a ""best practice"" to access another process in the OS through java?",161529
Does this query look optimized?,161524
How do I insert HTML-Formatted Strings into a Microsoft Word Document using Visual Basic while preserving formatting?,161519
Linking an external .jar from an Xcode java project?,161518
WinForms: color DataGridView border,161513
'pass parameter by reference' in Ruby?,161510
Non intrusive 'live' help system,161499
How to Execute an application in XP when a particular type of USB device is attached,161497
Is there a nice way of handling multi-line input with GNU readline?,161495
