Question,ID
How should I learn C? [closed],184676
How to make a hotfix deployment using Visual Studio?,184669
"Should I practice ""mockist"" or ""classical"" TDD? [closed]",184666
How can you validate Elements based on an attribute Value using a Schema?,184663
Should I change my utilities.pl to a utilities.pm module?,184662
How to keep automated tests fast?,184661
SharePoint Lists vs Database Tables performance,184653
What is the best way to handle change management? [closed],184652
What is the best way to copy a list? [duplicate],184643
Concatenating arbitrary number of rows of strings in mysql (hierarchical query),184641
What is the best comment in source code you have ever encountered? [closed],184618
Will reassigning a variable in every iteration of a loop affect performance?,184609
Has and belongs to many relationship with multiple databases,184600
MINUS in MySQL? [duplicate],184592
Is there a Perl-compatible regular expression to trim whitespace from both sides of a string?,184590
System.NotSupportedException error in compact framework pictureBox control. How do I make a picture button in Compact framework?,184585
How to append binary values in VBScript,184574
ASP.NET: How to convert <A> or HtmlAnchor to static text?,184570
Checkstyle vs. PMD,184563
How to monitor MySQL space?,184560
What do I need to do to upgrade an application to the latest Rails version?,184550
How are people using Google App-Engine apps with their own domains?,184541
Fuzzy .png in Flash CS3,184538
In what cases do I use malloc and/or new?,184537
ListBox keep selection after losing focus,184522
Create GUI similar to Windows Explorer using WPF,184511
On a unix/linux system how can I learn more about a mylib.a archive?,184502
"Java Applet, AWT Refresh, issue on Mac OS X 10.4",184491
How to get an image stored as an oracle blob into an Image object,184489
What is an intuitive way to move an XmlNode from one XmlDocument to another?,184486
"enter multiple variables into table, assigning to each appropriate record",184482
PowerShell generic collections,184476
Multiple DB Updates:,184471
Is there an equivalent to SHA1() in MS-SQL?,184456
EnumPorts() returns strange error on some machines,184448
"Mate actionscript only version, does it exist?",184443
"Access Alter Table ""Allow Zero Length""",184436
Tax Service Recommendation for a Rails App? [closed],184435
Converting XML to plain text - how should I ignore/handle whitespace in the XSLT?,184431
Outlook PropertyFrom MAPI Schema Property ID,184427
Execute action for automatically unchecked button in Delphi,184414
NSAutoreleasePool in NSOperation main?,184409
Upsizing a split Access database,184406
What is the best HTML Rendering Engine to embed in an application? [closed],184373
Multiple users XDebug and PHP Debugging,184365
What's the purpose of sequental uniqueidentifier in PK of MS SQL?,184359
Vista Window Focus Problem,184340
"What is the difference between Obfuscation, Hashing, and Encryption?",184328
Can clone VM be application backup plan?,184319
Regex failing on right parens,184313
