Question,ID
IP subnet verification in JSP,178200
Python: can I have a list with named indices?,178199
In ASP.NET MVC I encounter an incorrect type error when rendering a page with the correct typed object,178194
Bitfields in C#,178188
OO Design: Multiple persistance design for a ruby class,178187
Reading the Exchange server time via MAPI,178173
How can I verify if a Windows Service is running,178147
"How to create an automatically managed ""last update"" field with Microsoft Access",178144
"How to Pass an Object Method as a Parameter in Delphi, and then Call It?",178138
Transfer Dependency Property value of a UserControl to a Control inside it,178135
Functions vs Stored Procedures,178128
Porting windows manual-reset event to Linux?,178114
DDD and Asynchronous Repositories,178070
How do you disable the CPU window in Delphi 7,178068
"Why is ""null"" present in C# and Java?",178026
How do I embed a Google map into a Flash website?,178020
Different results selecting HTML elements with XPath in Firefox and Internet Explorer,178016
Simulating <%#Bind(...) %>,178005
WSGI Middleware recommendations [closed],178001
How to get rectangular multiple selection behavior in Comtl32.dll ListView [duplicate],177993
Downloading document from internal server externally,177989
How can I make email go to a local folder during testing?,177974
Is there a way to get DateTime value from timestamp type column?,177970
Multidimensional Repeating Data Control,177968
Displaying path/version information for a loaded COM object?,177965
ASP.NET 2.0 Membership database?,177964
"Compiling in c++ with mysql, pthreads and gtk",177960
What is the best way to convert an int or null to boolean value in an SQL query?,177956
Webdav windows server 2008 not allowing doc files to save,177953
How to define multiple elements in XML Schema with the same name and different attribute value allowed?,177945
How to Implement Ocean Surface Effect Using OpenGL ES 1.1? [closed],177935
Users not showing up in Sharepoint Audiences [closed],177929
"What is a good design for a query ""layer"" for Java JPA",177927
How to set focus in WPF page reload?,177911
Accessing python egg's own metadata,177910
Detailed information from QObject::connect,177906
How to avoid an anemic domain layer and still have rich validation and business rules,177905
What does WISC (stack) mean? [closed],177901
Looking for something similar to offsetof() for non-POD types,177885
How can I include a servlet in a jsp page?,177883
Counting items of each priority level in an IBM MQ Series Queue,177874
How do I copy the data of an element with jQuery? [duplicate],177867
"Firefox cuts files, whose name contains spaces, in a Struts application",177863
"Questions about exporting and importing flatfiles (txt, csv) in SQL Server 2005",177860
How do I trap Ctrl+C (SIGINT) in a C# console app?,177856
A doubt with the ICloneable interface in petshop 4.0?,177836
Get random data using Generics,177835
"When developing a website with visual studio, how do I improve the build time?",177826
"Cheap / free ""Look and Feel"" frameworks for web applications [closed]",177818
POST multiple parameters [closed],177815
