Question,ID
What is the meaning of 'attempt to index upvalue',195582
Is it possible to set a style of link that shows only when the linked webpage is being viewed?,195578
Is there a tool which lists exported methods from a DLL?,195571
Flex - Laying out text within a Canvas,195549
Deriving COM interfaces in .NET,195548
How would you implement an RSS feed in a Java web environment?,195537
"In production, Apache + mod_wsgi or Nginx + mod_wsgi?",195534
"ASP.NET Photo API (Shutterfly, etc . .)",195532
"What is a SQL ""pseudocolumn""?",195530
Bidi associations and NHibernate mapping,195528
__REQUIRED_RPCNDR_H_VERSION__,195524
What is spaghetti code? [closed],195520
History data from IE,195510
"Is Javascript a proper platform for cryptography? Or, can it be? [closed]",195509
How to obtain a list of available COM interfaces in Windows,195508
RichTextBox and underline color,195507
Switch Requests to Content Specific to Requesting Domain,195504
Resources for I18N in C++ [closed],195497
Why do old editors like Vim and Emacs expose the difference between a File and a Buffer in the interface?,195485
C# check if a COM (Serial) port is already open,195483
synchronizing io operation in java on a string method argument? [duplicate],195468
Unit testing a module that checks internet connectivity,195460
How do I access IMetaDataEmit and other MetaData COM interfaces from C# or F#?,195455
Password protected .NET ClickOnce deployment?,195454
How to fetch the middle mouse button in java?,195451
"What should I use the ""My"" namespace for in VB .NET?",195450
Can you have two forms on a page with ASP.NET MVC?,195439
Loading JSP pages from custom sources,195437
How can I get top terms for a subset of documents in a Lucene index?,195434
TransactionScope bug in .NET? More information?,195420
How to log in an Oracle database?,195410
Limit displayed length of string on web page,195408
"Transactions, when should be discarded and rolledback",195377
Dataset ReadXmlSchema Errors,195368
"Inserting a newline into a pre tag (IE, Javascript)",195363
Where do I find the Eclipse JavaServer Faces config editor palette?,195359
What is a handler? [closed],195357
Where to find a good reference when choosing a database?,195353
"ASP.NET, XSLT and dynamic controls",195340
Internet Explorer Debug Mode - Is there a quick way to enable/disable it?,195335
"How to test with RSpec a Rails plugin using ""link_to"" and ""current_page?""",195334
"How to deal with old, obsolete database data of a long running system?",195332
What is the most elegant way to read a text file with c++?,195323
"Why is Class.newInstance() ""evil""?",195321
Button generated for each item in an XSLT file runat server,195317
Check if serial port is listening,195304
WebTextEdit ClientSideEvent Javascript - Can't Eval,195302
Disable Visual Studio's validation of non-xml files that look like xml?,195293
ASP.NET OleDbConnection Problem,195288
Swap every pair of characters in string,195287
