Question,ID
What are some good DirectX resources for a beginner? [closed],186073
Left Join outperforming Inner Join?,186071
Can an ASP.NET MVC controller return an Image?,186062
Is it considered bad practice to use absolute positioning? [closed],186044
Is there any way to validate the width and height of image when uploaded?,186037
"Is it possible to print a DIV that is hidden by jQuery's ""slideUp"" function",186035
How do you explain this structure in JavaScript?,186024
What's the best way to find a string/regex match in files recursively? (UNIX),186015
How do I listen/identify when a program runs in Windows using C++?,186004
MVP examples for Windows Forms,185993
What open source .Net utility projects or code libraries do you use? [closed],185987
Configuring IIS on Windows Vista Home Edition,185983
How do I create a heterogeneous Array in Scala?,185972
Generate an E-R Diagram by reverse-engineering a database [closed],185967
How to select a range of elements in jQuery,185966
Rails: How to change the title of a page?,185965
How do I send an alert to a blackberry from an Excel 2007 spreadsheet?,185962
Can I pass a sharepoint security context value to a reporting services report parameter?,185953
How Do I Detect the Adobe Acrobat Version Installed in Firefox via JavaScript,185952
Ruby: define_method vs. def,185947
Overriding the java equals() method - not working?,185937
How to delete the contents of a folder?,185936
How do I create a copy of an object in PHP?,185934
WeakReference and event handling,185931
What is the difference between a symbolic link and a hard link?,185899
Localization / internationalization tool [closed],185898
Deleting Visual Studio binary output folders automatically?,185896
How do I analyze a .hprof file?,185893
Qt: difference between moc output in debug and release?,185883
MySQL 5 (32bits) on Windows 2008 server,185878
New project: I am having troubles picking a language to use,185862
How to initialize private static data members in a header file,185844
"How to Write a ""Fake"" ListBox",185842
Equivalent of Class Loaders in .NET,185836
"What, exactly, distinguishes between private and protected (in Flex)?",185825
How to control the font DPI in .NET WinForms app,185804
How can I make the Visual Studio debugger stop breaking at data breakpoints which are set to run a macro and continue?,185797
Apache: Caching a DEFLATE'd file,185782
Finding the LCM of a range of numbers,185781
Modifying NSDate to represent 1 month from today,185780
How to get proper line number when using trigger_error in PHP?,185778
Access HTTP response headers in for flash.net.URLLoader object?,185761
How can I turn an int into three bytes in Java?,185747
Is BitmapSource the only type can be used in Image Source?,185741
Would you architect the control API of the next-gen Mars rover to be RESTful instead of an RPC?,185740
IE Chopping off left of DIV,185709
Winform Caching,185706
How do I copy files using Windows Batch?,185698
The Most Efficient Way To Find Top K Frequent Words In A Big Word Sequence [closed],185697
SVN client on windows without administrator rights,185693
