Question,ID
What is the difference between <% %> and <%=%>?,197047
Setting default values for columns in JPA,197045
What's the best scheme for eliminating blog- or comment-spam [closed],197041
where is the Oracle Event Log located?,197033
"system('php file.php'); doesn't work, why?",197028
How can I declare a dropdown box in a view to set a value to a model in ASP.NET MVC?,197027
How to find out whether subversion working directory is locked by svn?,197009
What is the easiest way to learn ActionScript when you know JavaScript?,197008
Is there a good wrapper around ILGenerator? [closed],197005
wordpress - having comments inline ajax like in stackoverflow,196993
list iterator not incrementable,196976
Convert string to Title Case with JavaScript,196972
Where does jQuery UI fit in MVC?,196966
Can you list the keyword arguments a function receives?,196960
How to run NOT elevated in Vista (.NET),196949
Does Android WebView need permissions for opening external URLs?,196946
Reflection and generic types,196936
How to check if OS is Vista in Python?,196930
How to trim() white spaces from a string?,196925
How to ensure user submit only english text,196924
How do I change OutDir variable in Visual C++?,196920
Open source OCR tool available in the market [closed],196918
Which wiki will let me dynamically create a page when its link is clicked?,196913
Editing SQL query with Visual Studio 2008,196909
"Locking Executing Files: Windows does, Linux doesn't. Why?",196897
Java2D Performance Issues,196890
Running on 32 or 64 bit matlab?,196885
ASP.net page life cycle,196883
Is there a better way to get a named series of constants (enumeration) in Python? [duplicate],196876
Change Text Box Color using Required Field Validator. No Extender Controls Please,196859
Which Subversion web interfaces have a blame feature?,196857
Searching for a safe way to do authentication from a mobile app,196845
How do I emulate Python's named printf parameters in Ruby?,196841
Drop Down List with WPF Menu Controls,196840
What is the easiest/best/most correct way to iterate through the characters of a string in Java?,196830
ReSharper (or something like it) for Visual C++? [closed],196828
Java file input as command line argument,196824
Cross-platform editor control [closed],196820
Export to Excel from Crystal Reports without page headers/footers,196817
Is there a way to control the animation on a UITableView scrollToRowAtIndexPath?,196795
How do I set up my Ubuntu VPS to send outgoing mail? [closed],196791
How do I get character offset information from a pdf document? [closed],196788
Which AES library to use in Ruby/Python?,196776
What is the best way to escape Python strings in PHP?,196771
How can I search through Stack Overflow questions from a script?,196755
"What does ""select((select(s),$|=1)[0])"" do in Perl?",196754
How do you slice arrays in D?,196741
How to add NUnit in Visual Studio,196740
Why not use 'protected' or 'private' in PHP?,196737
How can I use covariant return types with smart pointers?,196733
