Question,ID
Get a list of files on server with ASP.NET using a picker,148817
How to find unused attributes/methods in Visual C++ 2008,148807
How to deploy complex SQL solutions through an installer?,148798
What is the standard SQL Query to retrieve the intersection of tables?,148795
What is the impact of having namespaces in multiple DLLs?,148790
How to shift items in an array?,148786
Is there a list of the common show routines in Vxworks?,148764
Silverlight and Rails,148752
What is the difference between a framework and a library? [closed],148747
How to detect if any specific drive is a hard drive?,148742
Intercept Windows Vista shutdown event in C#,148733
How to set/change/remove focus style on a Button in C#?,148729
Scrollable JDesktopPane?,148728
ASP.NET MVC input validation,148725
User Control Public Shared Variables in ASP.NET 1.1 Not Working As Expected,148723
How to bind from a ContentTemplate to the surrounding custom Control?,148704
iSeries Export to CSV,148689
Unloading classes in java?,148681
Tool Comparison: Visual Assist X and Resharper,148678
"Play a sound, wait for it to finish and then do something?",148676
How do I refresh the relationships in a dataset?,148672
Why is the fact that Microsoft decided to support jQuery such a big deal?,148670
Local variables with Delegates,148669
What is the least amount of code needed to update one list with another list?,148662
"Oracle: is there a tool to trace queries, like Profiler for SQL Server? [closed]",148648
Regular expression to filter files in OpenFileDialog,148642
Customizing AntRunner output,148641
How to get master-master replication with Subversion?,148625
Migrating MediaWiki Sites over to Windows Sharepoint Services Wiki,148619
Accessing constant values from an Apache Velocity template?,148601
.NET Timers: Whats is the best way to be notified in X seconds?,148594
Has anyone written a thread-safe BindingList<T>?,148587
Using emacs tramp vs. rsync for remote development,148578
Using pre-compiled headers with CMake,148570
Storing database data in files?,148568
Access a 2nd project in the same solution with MSBuild,148556
Creating my own Iterators,148540
NoClassDefFoundError with a long classname on Tomcat with java 1.4.2_07-b05,148530
Entlib versus ACA.Net - Does ACA.Net provide any advantage?,148520
How to Regex search/replace only first occurrence in a string in .NET?,148518
Does nmake have build tasks?,148513
Limiting range of value types in C++,148511
JQuery Flickr file upload not working,148503
Advantages and drawbacks of chainable methods?,148493
Java 2D Drawing Optimal Performance,148478
How to use sed to replace only the first occurrence in a file?,148451
How can I get the content of the file specified as the 'src' of a <script> tag?,148441
Removing button while progress is displayed,148421
Why does the code below return true only for a = 1?,148407
UTF8 to/from wide char conversion in STL,148403
