Question,ID
Advanced searching in Vim,131559
Is it expected that all the units of a Project Group in Delphi 7 to be in one folder?,131540
How do you get the state to which a (.net) form will be restored?,131537
What can cause ASPNET AJAX page to revert to normal ASPX mode ? / UpdatePanel broken,131535
HTTPHandler tag in Web.Config breaks asmx Files,131518
Should constructor variables pass direct to private fields or properties?,131517
Delphi 7 make complains about files not found,131516
Which browsers and operating systems do you target on new websites?,131508
What am I missing by not moving my ASP.NET 2.0 site to ASP.NET 3.5?,131498
max time a report should take to generate report,131488
Preventing Mongrel/Mysql Errno::EPIPE exceptions,131481
WSE 2.0 Web Services Client using .NET 2.0,131475
EWOULDBLOCK equivalent errno under Windows Perl,131473
How do you apply a .net attribute to a return type,131456
Do I have to cause an ValueError in Python,131449
Forcing a ListView to draw in the background,131448
C++ tr1 on GCC 3.4.4 (for the Nokia N810 tablet computer),131445
How can a C program produce a core dump of itself without terminating?,131439
Using AppleScript to hide Keynote Text Fields in A Slide,131435
Sources for learning about Scheme Macros: define-syntax and syntax-rules,131433
What is the best method to convert floating point to an integer in JavaScript?,131406
Is there a Dependency Injection framework for PHP4?,131393
SVN installation,131367
Deploying Perl to a share nothing cluster,131362
Strange VB6 build problems (related to nlog),131358
How do you organize and keep track of multiple (many) projects [closed],131337
"What is the best way to measure ""spare"" CPU time on a Linux based system",131335
Style - When to serialize a Django model Instance: signals vs model's save method,131327
2d Data Structure in C#,131326
How can I measure the actual memory usage of an application or process?,131303
"""Hidden Secrets"" of the Visual Studio .NET debugger? [closed]",131263
Why use iterators instead of array indices?,131241
In sharepoint designer's workflow editor how do I get the workflow initiators username?,131238
Can you Catch an Exception after the main application unit has ended?,131217
Convert console exe to dll in C,131196
What is a .snk for?,131181
error installing RMagick from gem,131179
Web Log analysis in Java,131176
Evolutionary Algorithms: Optimal Repopulation Breakdowns,131165
Oracle Insert via Select from multiple tables where one table may not have a row,131164
Resources for code generation of database objects,131142
Streaming large result sets with MySQL 4.1.x + Connector/J,131139
What standard techniques are there for using cpu specific features in DLLs?,131128
"How do I get a range's address including the worksheet name, but not the workbook name, in Excel VBA?",131121
What's a good Systems Interface Specification template?,131117
How often do you update statistics in SQL Server 2000?,131116
Writing a cookie from an ASP.Net HTTPHandler - Page.Response object?,131110
OpenID Over SSL with self signed certificate,131091
How big of a security risk is checking out an svn project right into production site?,131089
What's the quickest way to dump & load a MySQL InnoDB database using mysqldump?,131085
