Question,ID
What open source C++ static analysis tools are available? [closed],141498
Is there an easy way to populate SlugField from CharField?,141487
How to configure secure RESTful services with WCF using username/password + SSL,141484
Recursive List Flattening,141467
jdbc driver for Microsoft SQL Server CE(Compact Edition) 3.5,141454
How to purge expired items from cache?,141452
Javascript to detect whether the dropdown of a select element is visible,141450
How do I wrap a string in a file in Python?,141449
Is a JavaScript try-catch ignoring an expected occasional error bad practice?,141441
Advantages of using MSBuild or NAnt versus running DevEnv.exe from command-line,141435
How can I create a status bar item with Cocoa and Python (PyObjC)?,141432
Is there a standard implementation for Electronic Signatures on fill-in-form web applications?,141428
Gracefully closing a frame (toolbar) around an iframe,141427
"If I register for an event in c# while it's dispatching, am I guaranteed to not get called again during that dispatch?",141423
How can a transform a polynomial to another coordinate system?,141422
Tomcat 6.0.18 service will not start on a windows server,141411
How do I re-import a subreport into Crystal reports 9.0 without getting an Access Denied error?,141406
Yahoo GeoPlanet & XPathNavigator C#,141405
Best way to handle block ciphers in C++? (Crypto++),141399
Dynamic RadioButtons,141388
How to emulate Emacs’ transpose-words in Vim?,141372
INotifyPropertyChanged property name - hardcode vs reflection?,141370
Calculating the elapsed working hours between 2 datetime,141368
Flex Post Event Screen Updates,141360
Team Foundation Server - Use API to Sync to SVN,141353
How do I find what is using memory in a Python process in a production system?,141351
How to parse a time into a Date object from user input in JavaScript?,141348
xsl scope help,141345
How to check if a directory exists in %PATH%,141344
"Should I store entire objects, or pointers to objects in containers?",141337
Perl - Win32 - How to do a non-blocking read of a filehandle from another process?,141332
What's the difference between Phing and PHPUnderControl?,141319
"php check for a valid date, weird date conversions",141315
Pronouncing dictionaries [closed],141312
Checking File is Open in Delphi,141302
How to list only top level directories in Python?,141291
Possible to use Flex Framework/Components without using MXML?,141288
The difference between the Runnable and Callable interfaces in Java,141284
What's the best way to count keywords in JavaScript?,141280
Subqueries vs joins,141278
Can someone explain hex offsets to me?,141262
Windows .url links that point to same address when copied over or deleted,141251
Stateless EJB question,141249
Suppress ClientAbortException in struts2 VelocityResult class,141248
MATLAB Environment Tweaks [closed],141247
Controlling property names on serialized ASP.Net Ajax Objects,141244
Exceptions vs Result Codes for a socket client class,141242
"Does java have an equivalent to the C# ""using"" clause",141241
How many database indexes is too many? [closed],141232
How to have a LinkClicked event using an ArrayList of LinkLabels in .NET,141212
