Question,ID
Best way to get data from a DataReader into a Farpoint Spreadsheet?,152814
What is wrong with this _popen / select example?,152807
Is there a better way to trim a DateTime to a specific precision?,152774
Transpose a set of rows as columns in SQL Server 2000,152770
Which are the differences between dialog|main/child/mdi windows?,152766
Is java object serialization compatible between 1.5 and 1.6,152757
Optimising C++ 2-D arrays,152745
Should a client handling process be added to the supervisor tree?,152744
GDI+ / C#: How to save an image as EMF?,152729
What online resources are there to learn about VxWorks?,152723
Multiple correct results with Hamcrest (is there an or-matcher?),152714
Could I get in legal trouble for copying a website's stylesheet? [closed],152712
How can I search for a multiline pattern in a file?,152708
Open the default browser in Ruby,152699
CruiseControl.net : Using SvnLabeller / SvnRevisionLabeller,152694
Avoid throwing a new exception,152693
How can you scan an image with X++,152692
Is Eclipse the best IDE for Java? [closed],152691
WinForms printing: how can I access the progress dialog?,152676
DataReader within try block causing potential null reference error,152675
How to prevent Windows Installer from running each time Access 2003 and 2007 start when there are installed on the same machine? [closed],152670
Different item template for each item in a WPF List?,152664
Idiomatic C++ for reading from a const map,152643
Wordpress Site Monitoring software / service [closed],152623
How can I know on the client side when the HTTP handler is done processing?,152618
C#: Getting maximum and minimum values of arbitrary properties of all items in a list,152613
F# style - prefer () or <|,152602
How to initialize ConnectionStrings collection in NUnit,152586
Identify GET and POST parameters in Ruby on Rails,152585
"Is this a reasonable ""Application entry point""?",152582
What's the canonical way to check for type in Python?,152580
How do you handle TDD in the continuous integration?,152579
*.h or *.hpp for your C++ headers / class definitions [closed],152555
Stored procedure bit parameter activating additional where clause to check for null,152541
What is the best way to select string fields based on character ranges?,152537
Are there guidelines for updating C++Builder applications for C++Builder 2009?,152528
How do I rename all folders and files to lowercase on Linux?,152514
"What does this do? tasklist /m ""mscor*""",152506
MSBuild: How to obtain number of warnings raised?,152487
Is there a way to print all methods of an object? [duplicate],152483
ASP.NET user login best practices,152469
What is the best way to change a user-password remotely in Unix?,152468
Running a J6SE app on an NT box,152462
What is the difference between a port and a socket?,152457
SQL-Server: Is there a SQL script that I can use to determine the progress of a SQL Server backup or restore process?,152447
Unit testing for PL/SQL [closed],152441
LDAP entire subtree copy,152439
Do you recommend Native C++ to C++\CLI shift? [duplicate],152436
Code coverage for PL/SQL,152435
Caching the sessionfactory,152432
