Question,ID
GetCallbackEventReference doesn't work synchronously,147458
What are the dangers of using a wild card with a Java import statement? [closed],147454
What are valid characters for creating a multipart form boundary?,147451
Writing Color Calibration Data to a TIFF or PNG file,147449
"Difflib.SequenceMatcher isjunk optional parameter query: how to ignore whitespaces, tabs, empty lines?",147437
What is the best way to set-up authentication in a tomcat webapp?,147420
Copy collection items to another collection in .NET,147416
Performance challenge: NAL Unit Wrapping,147408
Using boost::random as the RNG for std::random_shuffle,147391
Options for refactoring bits of code away from native C++?,147378
Database under source control again!,147376
How does this C++ function use memoization?,147372
Totaling a GridView in ASP.NET,147364
What is the best way to test a stored procedure?,147362
How to save an encrypted string to the database?,147359
Converting Win16 C code to Win32,147351
Visual Studio 6 tips and tricks [closed],147339
Accepting form fields via HTTP Post in WCF,147328
CScrollView and window size,147323
MySQL Row Format: Difference between fixed and dynamic?,147315
.NET : How to set user information in an EventLog Entry?,147307
Multithreaded Memory Allocators for C/C++,147298
Easy way to use variables of enum types as string in C?,147267
jQuery - Triggering Events from Clicking on a Link Issue,147264
Can I have non-measure codes mixed with measures in my fact table?,147260
"How can I remotely (via web services) determine date format of SharePoint 2003 site, for use in Versions.asmx returned XML?",147245
Ruby isPrime Method,147240
How can I reseed an identity column in a T-SQL table variable?,147210
How to hide table rows without resizing overall width?,147208
Transactions in REST?,147207
"Why do we need anything more than HTTP GET, PUT, POST?",147187
RoR + SMS: Rails web app architecture to send/receive SMS?,147184
Low Friction Minimal Requirements Gathering [closed],147182
How can I convert my Java program to an .exe file? [closed],147181
"What is a good, simple way to compute ISO 8601 week number?",147178
`testl` eax against eax?,147173
What is the benefit of global resource URIs (i.e. addressability)?,147172
"SMS + Web app: Providers of SMS ""Long codes"" for use by U.S. carrier subscribers within U.S.?",147164
Easy way to scroll overflow text on a button?,147154
Why doesn't C++ have a garbage collector? [closed],147130
c# downcasting when binding to and interface,147129
How to diagnosis app crash from OS X error log?,147126
"Why do discussions of ""swappiness"" act like information can only be in one place at a time?",147125
Are there any free ways to turn an html page into an image with .net,147100
How are permissions inherited on an Ubuntu Server?,147084
How can a service control its own state?,147083
Does iPhone support XML-RPC?,147062
Unix path-searching C function [closed],147057
Outlook attachments.Add() is not showing in mail body,147053
REGEX: Grabbing everything until a specific word,147052
