Question,ID
Are there any disadvantages to always using nvarchar(MAX)?,148398
How do I inspect the Asp.Net request pipeline?,148384
Nifty live web tracking [closed],148381
Restrict Template Function,148373
How can I give keyboard focus to a DIV and attach keyboard event handlers to it?,148361
Where do you check to if a hotfix from Microsoft have been applied to any service packs?,148358
Is it possible to create and then upload an Image file to a web server from silverlight?,148354
how to register url handler for apache commons httpclient,148350
How to upload files from ASP.NET to another web application,148322
Portal Style & Theme,148314
Best Way to Manage Configuration Data,148305
How to check for equals? (0 == i) or (i == 0) [closed],148298
How to print values at points with Google Chart API?,148295
How do you implement audit trail for your objects (Programming)?,148291
Eclipse C++ pretty printing?,148281
Word spell check runs slow on Word 2007/Vista,148279
How do I draw transparent DirectX content in a transparent window?,148275
Oracle database startup problems,148262
CSS centering tricks [closed],148251
Is there any way to check which kind of RAM my computer uses without opening it up?,148249
LOAD SQL Table from flat file,148239
How to extract four unsigned short ints from one long long int?,148225
Run macro in visual studio when solution is closed,148218
coordination between Design and Development [closed],148208
ObjectDataSource Update method with dynamic parameters,148205
Equivalent of PHP's print_r in Java?,148204
logging soap requests in flex 3,148203
Integrating jQuery into an existing ASP.NET Web Application?,148202
SQL2005 Express slow from remote VB6 application,148190
How efficient is define in PHP?,148185
where can i download opengl for windows vista [closed],148182
What is the best way to create a script to use with the rails request profiler?,148181
Strange MFC / VC++ Linker Error (std::list<CRect> already defined),148178
"When deleting hasOne or hasMany associations, should the foreignKey be set to NULL?",148169
Generate getters and setters (Zend Studio for Eclipse),148161
Sharepoint Workflow Modification is not disabled,148157
Is there anyway to tell Visual Studio not to open all the documents when I load solution?,148143
"Oracle sql query, concatenate fileds with CASE section",148136
How do I peek at the first two bytes in an InputStream?,148130
Performance considerations for Triggers vs Constraints,148129
What framework would you recommend for making desktop-like apps for the web? [closed],148118
How can addChild choose the wrong insertion index?,148116
enabling/disabling asp.net web service extension via script,148097
"""Colorizing"" images in .NET",148086
How to deploy an ASP.NET Application with zero downtime,148084
How to convert a string into bignum in C code which extends Guile?,148079
How to make a method exclusive in a multithreaded context?,148078
Is the sorting algorithm used by .NET's `Array.Sort()` method a stable algorithm?,148074
Problem using large binary segment in OOXML,148071
Is encrypting AJAX calls for authentication possible with jQuery?,148068
