Question,ID
What's the best way to add tags to the head in Plone?,137911
C# Mono - Low Level Keyboard Hook,137893
How can you automate Firefox from C# application?,137880
Can JQuery.Validate plugin prevent submission of an Ajax form,137872
How to change directory security attributes using InstallShield?,137870
"Using the ""final"" modifier whenever applicable in Java [closed]",137868
Running Apache without explicitly declaring listening on ports such as :3000 or :6600,137849
Determining whether an object is a member of a collection in VBA,137845
Moving WCF service from IIS to a Windows service,137840
newline character(s),137837
Can Windows PE 2.0 support the .NET framework?,137817
What's your favorite C++0x feature? [closed],137812
"SQL SERVER, SELECT statement with auto generate row id",137803
Suggestions on using Flex with WCF and Linq to Entities,137793
SSRS: Change SQL Statement Dynamically,137784
Expand a random range from 1–5 to 1–7,137783
Should extension properties be added to C# 4.0? [closed],137775
"What does the ""no version information available"" error from linux dynamic linker mean?",137773
How is a real-world simulation designed?,137755
What is the best data structure in .NET for look-up by string key or numeric index?,137753
Can i update a signed jar using an ANT Task?,137745
MDIParent Tiling children,137743
How to use POP3 over SSL in C,137741
"How do I upload a HTML form with a username, password, multiple file uploads and then process it with PHP?",137730
Free mulitplatform installer,137723
Which distro of Linux is best suited for Java web apps? [closed],137720
"Spell-check in Aquamacs Emacs won't work: ""Wrong endian order.""",137717
Do you use WaTiR? [closed],137711
Does WebMethods ESB scale?,137699
C# 3 new feature posts (and not about .Net 3.5 features) [closed],137688
Apache Redirect only when entering a password,137679
How do you do polymorphism in Ruby?,137661
Where does Console.WriteLine go in ASP.NET?,137660
Persistence of std::map in C++,137659
Free install wizard software [closed],137657
IoC Containers - Which is best? (.Net) [closed],137647
How do you pipe an inputstream to a zipped file as it's read in with Java?,137645
Encapsulating SQL in a named_scope,137630
How do you render primitives as wireframes in OpenGL?,137629
Is Test Driven Development good for a starter? [closed],137623
Is it ok to call a virtual method from Dispose or a destructor?,137621
What is the best way to parse a web page in Ruby?,137605
How do I embed a custom user-control in MS Word?,137586
How can I perform a HEAD request with the mechanize library?,137580
Is programming a subset of math? [closed],137550
"Assembler library for .NET, assembling runtime-variable strings into machine code for injection",137544
"What makes this the fastest JavaScript for printing 1 to 1,000,000 (separated by spaces) in a web browser?",137534
Why is my stored procedure receiving a null parameter?,137530
How can I set what encoding must be used by a site?,137526
Where can I find tools for learning assembler on OS X? [closed],137523
