Question,ID
Proper place to call an event?,144106
Database Design [closed],144090
How to pass page's meta tags in ASP.NET MVC?,144088
Eclipse Ganymede not validating JSPs properly,144058
Recommended IRC server (ircd) for a small site? [closed],144049
How to incorporate Interactive Ruby into my development process?,144046
How do you get a flash mp3 player to keep playing if a user changes page?,144017
Choosing a database type [closed],144001
Is casting the same thing as converting?,143997
Where would you use C# Runtime Compilation?,143973
When should TAGs be preferred over BRANCHING and vice versa (in CVS)?,143971
Is there a S.M.A.R.T. Library for .NET or Java? [closed],143969
In-memory LINQ performance,143947
Delphi OTA and RTTI bug,143938
What is the best web based application to access a database,143936
varchar(255) v tinyblob v tinytext,143933
Wrap a SQL Reporting Matrix,143926
How do you run a single test/spec file in RSpec?,143925
Java EE and Grails: Communication with WebServices? Which framework?,143898
What is the fastest way to insert data into an Oracle table?,143872
Is there a .NET library for universal audio file decoding?,143856
Do you use code generation tools? [closed],143855
How does Multiple C++ Threads execute on a class method,143850
Best way to find if an item is in a JavaScript array? [duplicate],143847
Ruby: character to ascii from a string,143822
Determine if an HTML element's content overflows,143815
What are some good strategies to allow deployed applications to be hotfixable? [closed],143814
How to improve link performance for a large C++ application in VS2005,143808
How do you Serialize ScriptObjects to JSON to save in Silverlight Isolated Storage?,143793
Where to find beautiful PHP code to read? [closed],143792
How do I find which process is leaking memory? [closed],143791
when to pass function arguments by reference and when by address?,143788
"What is search.twitter.com's ""trending topics"" algorithm?",143781
What books should I read to have an undergraduate education in Computer Science? [closed],143760
PostgreSQL - Rename database,143756
MySQL and data file encryption,143750
Is it possible to trigger a link's (or any element's) click event through JavaScript?,143747
What you think about throwing an exception for not found in C++?,143746
"Refactoring ""include file hell""",143745
Font graphics routines,143739
How do I access a MessageBox with white?,143736
"Is there any difference between ""string"" and 'string' in Python? [duplicate]",143714
Comparing two bitmasks in SQL to see if any of the bits match,143712
Is it possible that F# will be optimized more than other .Net languages in the future?,143708
What is the performance hit of using TLS with apache?,143692
What is the best method to gather data about the use of your application?,143681
What's the best system for installing a Perl web app?,143680
Keep focus on an application,143651
Window styles / Minimal titlebar/borders,143633
Crypto/X509 certificate parsing libraries for Python,143632
