Question,ID
Connect to an Oracle 8.0 database using a 10g client,153151
How do I get a multi line tooltip in MFC,153134
Packing rectangles for compact representation,153123
How do I setup remote debugging from scratch for an Asp.Net app,153112
SQL Developer error,153095
Getting / setting file owner in C#,153087
How can I read MS Office files in a server without installing MS Office and without using the Interop Library?,153079
SQL Server 2008 Reporting Services on Failover Cluster,153078
Tool to visualise code flow (C/C++) [closed],153074
Converting a pointer into an integer,153065
Why isn't bittorrent more widespread? [closed],153064
Escape < and > in sed/shell,153062
Any ideas on how to make edit-in-place degradable?,153061
Is there any way to programmatically set the application name in Elmah?,153054
"Microsoft JET SQL Query Logging or ""How do I debug my customer's program?""",153053
What Happened to ASP.Net Mobile Web Forms?,153051
How to mock with static methods?,153048
Launch web page from my application,153046
ASP.NET MVC Client Side Validation,153039
How do I make foreign-key combo boxes user-friendly on an Access form?,153035
"SQL Server Management Studio 2005 ""Remember Password"" doesn't work",153033
"Insert rows into Access db from C# using Microsoft.Jet.OLEDB.4.0, autonumber column is set to zero",153023
How do I create an XML file using templating similar to ASP.NET,153021
How does ADO.Net Data services support POST being something other than create?,153019
"Suggestion on remoting (rpc, rmi) for Java SE client-server app?",152988
Do you put your indexes in source control?,152985
What would be a recommended choice of SSIS component to perform SFTP or FTPS task? [closed],152981
How do I detect a click outside an element?,152975
How can I convert a number to its multiple form in Perl?,152968
Can you use Java libraries in a VB.net program?,152967
Deployment tools ENTERPRISE - what is the best for Windows environment?,152957
Get notified that MS Excel file is no longer used in Progress 4GL (ABL),152946
When is modal UI acceptable?,152938
"In Visual Studio when viewing a changeset, how can I change the view of cs files?",152926
Get the contents of a Application Server directory,152919
Horrible VMware keyboard shortcuts [closed],152901
.NET XmlDocument LoadXML and Entities,152900
How would you design a form with many dynamic fields?,152893
OSI model - What's the presentation and session layer for?,152889
How do I resolve a merge conflict with SVN properties?,152887
Isn't resource-oriented really object-oriented?,152871
Using jQuery to Highlight Selected ASP.NET DataGrid Row,152869
"How can you use ""external"" configuration files (i.e. with configSource) with an MSTest unit test project?",152866
What features distinguish Flex from DHTML?,152846
"How to insert a string which contains an ""&""",152837
Default port for SQL Server,152834
How to analyse 'noisiness' of an array of points,152829
".htaccess files, PHP, includes directories, and windows XAMPP configuration nightmare",152823
How to declare a user-defined function returning node-set?,152822
"""Class does not support automation"" error when i call Request.ServerVariables(""remote_host"")",152817
