Question,ID
Wcf and Interfaces as Parameters,153775
What is the preferred way to redirect a request in Pylons without losing form data?,153773
How to see the schema of a db2 table (file),153769
How do I convert an Illustrator file to a path for WPF,153762
jQuery Datepicker with text input that doesn't allow user input,153759
How to inject Javascript in WebBrowser control?,153748
Vector and Layer Data Structure,153742
What are RFC's? [closed],153735
How do I break up high-cpu requests on Google App Engine?,153732
Validation Block vs Nhibernate.Validator,153731
How to round a number to n decimal places in Java,153724
What alternatives are there to Google App Engine? [closed],153721
Verify email in Java,153716
Creating music visualizer [closed],153712
Inheriting from protected classes in C+++,153707
change default collation in phpmyadmin,153706
Modelling Related Objects,153689
Managing Window Z-Order Like Photoshop CS,153685
7-Zip (7za.dll) .NET wrapper,153678
GUIDs in a C++ Linux GCC app,153676
Automating Word Mailmerge not working as expected,153666
Why do you need $ when accessing array and hash elements in Perl?,153644
Updating UI After Asynchronous WebMethod Calls,153639
Natural Sort in MySQL,153633
"How can you get the ""real"" HttpContext within an ASP.NET MVC application?",153630
How can I write a scheduler application in .NET?,153617
MPI or Sockets?,153616
Create MSBuild custom task to modify C# code *before* compile,153602
Unknown Column In Where Clause,153598
Efficient way of logging to txt file from a console program,153596
Programmatically access a Microsoft Project (MPP) file from C#,153593
How do I determine the intersection point of two lines in GDI+?,153592
"SQL sub-query problem with grouping, average",153585
"How to iterate over a timespan after days, hours, weeks and months?",153584
Can I assign a global hotkey to an Adobe AIR app?,153581
How can I clear event subscriptions in C#?,153573
Parser-generator that outputs C# given a BNF grammar? [closed],153572
What are some good profilers for native C++ on Windows? [closed],153559
Flex/Flash Debugging in the Browser,153553
Deactivating Weblogic Load Balancing Optimization for collocated objects,153537
Setting the character encoding in form submit for Internet Explorer,153527
Code to logging ratio? [closed],153524
Calculate the position of an accelerating body after a certain time [closed],153507
".Net CF Prevent Overzealous, Impatient Clicking (while screen is redrawing)",153496
Automated Python to Java translation [closed],153491
Setting ISO-8859-1 encoding for a single Tapestry 4 page in application that is otherwise totally UTF-8,153482
Is there a SQL Server profiler similar to Java/.Net profilers?,153478
Keeping in sync with database,153473
What are the best Open Source tools for developing Flash applications? What are the best places to start learning? [closed],153468
How do I set HttpOnly on a session cookie in Rails 2.1?,153461
