Question,ID
How to resize the Asp.Net Page based on the screen resolution,133691
.NET - How to hide invalid choices in a DateTimePicker,133690
Profiling PHP code [duplicate],133686
spawn a new xterm window,133680
Determine SLOC and complexity of C# and C++ from .NET,133679
Red eye reduction algorithm,133675
Format Date On Binding (ASP.NET MVC),133671
How can I access a mapped network drive with System.IO.DirectoryInfo?,133660
Insert a fixed number of rows 2000 at a time in sql server,133648
How do you return from 'gf' in Vim,133626
Balancing a Binary Tree (AVL),133610
"Sure Google Appengine scales, but is it also fast?",133608
Can regular expressions be used to match nested patterns? [duplicate],133601
Setting Radio Button enabled/disabled via CSS,133596
How to convert multiple <br/> tag to a single <br/> tag in php,133571
Hashtable in C++?,133569
Good examples of UK postcode lookup flow [closed],133567
How do I use a remote MSMQ transactionally?,133559
Good idea to access session in observer or not?,133558
.NET Windows Integrated Authentication,133549
Is reading /dev/urandom thread-safe?,133546
First impressions of the Fantom programming language? [closed],133528
Autogeneration of a DataContext designer file when using SqlMetal and Visual Studio,133515
Ruby to Actionscript3 Bytecode,133506
Check for a valid guid,133493
How do I remove an element that matches a given criteria from a LinkedList in C#?,133487
What DNSs have API access? [closed],133458
IPSec AES 256 encryption in Windows XP with Service Pack 3?,133453
Can a TCP/IP Stack be killed programmatically?,133442
How can I get access to the HttpServletRequest object when using Java Web Services,133436
propertyNameFieldSpecified when generating a 2.0 web service proxy from a WCF Service,133430
How do you handle small sets of data?,133420
What is an orthogonal index?,133418
How do I set the Content-type in Joomla?,133394
Password encryption in Delphi,133393
Configure db used for ASP.Net Authentication,133390
Elevating process privilege programmatically?,133379
.NET: SqlDataReader.Close or .Dispose results in Timeout Expired exception,133374
How do you handle strings in C++?,133364
How do you find the namespace/module name programmatically in Ruby on Rails?,133357
"What's the difference between a ""Data Service Layer"" and a ""Data Access Layer""?",133350
"Subclipse error message ""Expected format '3' of repository; found format '5'""",133335
Programmatically delete emails and SMSs on a Window Mobile device,133330
Develop SharePoint web parts in ASP.NET [closed],133328
Minimize an external application with Delphi,133325
"In Perforce, can you rename a folder to the same name but cased differently?",133320
Good database table design for storing localized versions of data [closed],133313
"How can I get jQuery to perform a synchronous, rather than asynchronous, Ajax request?",133310
Subfolders in CodeIgniter,133308
Threading when sending emails,133287
