Question,ID
Are there any emulator for the JTAPI API?,133282
Castle-ActiveRecord Tutorial with .NET 3.5 broken?,133281
Do I have to use Viewstate in ASP.NET,133277
Illustrating usage of the volatile keyword in C#,133270
Text from UITextView does not display in UIScrollView,133243
ASP.Net Session,133236
Building Eclipse plugins and features on the command line,133234
How can I discover resources in a Java jar with a wildcard name?,133229
Eval scripts in server side control property,133226
ASP.NET/IIS: 404 for all file types,133225
Is there a typical state machine implementation pattern?,133214
"In Perforce, how do I get a list of checked out files?",133204
Embedded Outlook View Control,133194
Rules for properly organized bugtracker (Mantis et al),133175
Classic ASP and ASP.NET Integration,133173
How do I implement quicksort using a batch file?,133154
LLBLGen: How can I softdelete a entry,133143
What is the best way to configure iPlanet/Sun ONE be the HTTP/HTTPS front end to a JBoss/Tomcat application?,133136
Eclipse Search Menus disabled randomly,133129
Any other IDEs for Lotus Notes other than Domino Designer?,133125
How to change a Window Owner using its handle,133122
What is the list of JConnect error-codes? [closed],133112
How can I carry out math functions in the Ant 'ReplaceRegExp' task?,133111
ASP.Net Medium Trust setup,133109
How secure is basic forms authentication in asp.net?,133106
Best Practices for Internationalizing a Flex Application?,133094
How do you identify duplicate values in a numerical sequence using XPath 2.0?,133092
What's the best to method call a Webservice from ASP?,133087
Most efficient way in SQL Server to get date from date+time?,133081
How should I bind a web UI against XML attributes?,133077
What is the difference between visibility:hidden and display:none?,133051
Control for tags with auto-completion in Winforms?,133049
How to check if a column exists in a SQL Server table,133031
What is Big O notation? Do you use it? [duplicate],133008
Flex HttpService : appending to destination,133002
"Is there a difference between ""=="" and ""is""?",132988
How do you force a maven MOJO to be executed only once at the end of a build?,132976
What is the Windows version of cron? [closed],132971
How do I set a task to run every so often?,132955
Why does Castle Windsor hold onto transient objects?,132940
Force Https in Websphere 6.1,132921
How do I split the output from mysqldump into smaller files?,132902
What is the best way to generate XML Binding Code from a DTD?,132895
Best way to switch configuration between Development/UAT/Prod environments in ASP.NET?,132885
How to improve your dev team's Joel Test score? [closed],132872
I have a gem installed but require 'gemname' does not work. Why?,132867
How do I add an action to Visio (2003)?,132860
Test automation using batch files:,132857
Deterministic dispose of ThreadStatic objects,132830
"The permissions granted to user ' are insufficient for performing this operation. (rsAccessDenied)""}",132812
