Question,ID
Easiest and quickest way of Web enabling old VBA apps,138506
Pure Python XSLT library,138502
Sorting nvarchar column as integer,138501
Iterate all files in a directory using a 'for' loop,138497
Generating a report by date range in rails,138496
How to do a SQL NOT NULL with a DateTime?,138493
"Using own exceptions in wse, not only SoapException",138477
Get address of current page in Internet Explorer from toolbar,138466
merge custom skin & custom class into SWC,138458
Javascript: How to reload entire frameset onload() event including frame where Javascript is called,138457
How to convert a Unicode character to its ASCII equivalent,138449
Is there any way to create a stand-alone ButtonSpec in Krypton Toolkit?,138448
SQL Reporting services - Out of Memory Exception,138444
How to figure out the current Biztalk Host Process,138441
What's the best way to detect web applications attacks?,138432
How to determine from within Java which .NET framework is installed,138425
Landscape printing from HTML,138422
SQL Compact select top 1,138419
How to sort columns in an ASP.NET GridView if using a custom DataSource?,138412
Catching a tab close event in web browser?,138411
ToolTipping a Drop Down list,138408
How to programmatically unplug & replug an arbitrary USB device?,138394
Can you run a version 3 .Net binary on a version 2 CLR install?,138393
Simple toggle function with IE6,138392
What are the equivalents of colored grep?,138383
SHGetFolderPath() 32 bit vs 64 bit,138379
"How do I close a client connection early, while continuing to run my code?",138374
Class structure pattern question. What should I choose?,138371
How much faster is C++ than C#?,138361
Calling .NET assembly from Java: JVM crashes,138355
Dynamic radio button creation,138353
Playground Projects [closed],138348
Aborting an ASP.NET Web Service asynchronous call,138346
Starting to learn Windbg [closed],138334
Any decent text diff/merge engine for .NET? [closed],138331
"How can I use ClearCase to ""add to source control ..."" recursively?",138321
linux to compile multiple java file,138318
"How to extract img src, title and alt from html using php?",138313
How do I turn off CSRF protection in a rails app?,138311
Is it possible to manipulate an SVG document embedded in an HTML doc with JavaScript?,138309
Config Files for Biztalk Host Processes,138308
How can use SQLBulkCopy on a table with a GUID primary key and default newsequentialid()?,138302
Delphi 2009 and Informix dbExpress with Windows 2003,138298
"For your semantic web type application, do you use RDF or a proprietary model for the internal representation?",138292
How can I improve CVS performance in a multi-site scenario?,138280
Is the hash of a GUID unique?,138279
What are hashtables and hashmaps and their typical use cases?,138273
Select Query in SQL + All the values in columns,138261
How would I go about taking a snapshot of a process to preserve its state for future investigation? Is this possible?,138255
Calling WMPLib.mediaCollection methods from ASP.NET on IIS return empty lists,138251
