Question,ID
How to define persistent variable in SQL*PLUS,128232
Debugging with Events in Windows,128217
Embedding non-edit widgets in a DataGridView,128203
Retrieve Error text from SQL Server 2000 error,128190
Unicode in PDF,128162
"What does ""Create Statistics"" do in SQL Server 2005?",128129
Assembler file as input for a driver build with the WDK tools,128120
How do you find Leapyear in VBA?,128104
Determining the index of an Item on a Form (J2ME),128103
How can I write a unit test for a controller class that uses winforms for views?,128086
Dynamically adding controls in ASP.NET Repeater,128083
What are the benefits of functional programming? [closed],128057
In which cases do you test against an In-Memory Database instead of a Development Database?,128048
Algorithm for merging large files,128043
What to do with null fields in compare()?,128042
How can I lock a file using Java?,128038
How do I pull from a Git repository through an HTTP proxy?,128035
Why should I use Flex?,128034
Best way to safely read query string parameters?,128028
"Java, Swing: how do I set the maximum width of a JTextField?",128016
Make OSX application respond to first mouse click when not focused,128015
Variable UITableCellView height with subview,128012
Add dismiss control to session-flash() output in CakePHP,128011
When using a HashMap are values and keys guaranteed to be in the same order when iterating?,128008
Nested SELECT Statement,127974
Is it worth swapping Ctrl and Caps Lock for windows users that don't use Emacs,127973
Deleting Custom Event Log Source Without Using Code,127936
Working copy XXX locked and cleanup failed in SVN,127932
Why Aren't All My WinForm Controls and Forms Localizing?,127929
ASP .Net server control events order,127918
Compact Framework : any Finger Friendly GUI?,127914
How to use win32api from IronPython,127912
How to create reverse index for full text search in Common Lisp?,127911
Best way to register js for modularity in User Control,127899
Multiple ModificationForms in Sharepoint Workflow,127894
Which design patterns are underutilized? [closed],127890
What should the view file/directory structure be in ASP.NET MVC?,127886
How to add Announcement list/webpart to Publishing Portal,127884
Source Safe 6.0d and Visual Studio 2005 project tree problems,127878
SAX vs XmlTextReader - SAX in C#,127869
Using Blitz implementation of JavaSpaces,127867
ASP.NET Ajax - Asynch request has separate session?,127842
How do I bind an ASP.net ajax AccordionPane to an XMLDatasource?,127832
C# 3.0 - Object initializer,127817
What does a scrum master do all day? [closed],127807
How do I parse an ISO 8601-formatted date and time?,127803
Child Control Initialization in Custom Composite in ASP.NET,127794
Is every DDL SQL command reversible? [database version control],127780
Where can you find the C# Language Specifications?,127776
How do you pre allocate memory to a process in solaris?,127771
