Question,ID
Make a div fade away nicely after a given amount of time,124166
Should I never use primitive types again?,124148
Why are Exceptions not Checked in .NET?,124143
Moving the child nodes of an XML node upwards,124123
How to create Excel 2003 UDF with a C# Excel add-in using VSTO 2005 SE,124121
IIS 6.0 on Enterprise Server - Memory Limit,124118
.NET + Copying large amounts of memory tricks,124117
Passing around urls between applications in the same project,124108
What's the best way to implement clean UI functionality in WinForms while maintaining a decent decoupled architecture?,124096
How do I quickly slice and dice large data files?,124079
What do these abbreviations in network hostnames mean?,124076
"php String Concatenation, Performance",124067
SQL Server 2005 vs. ASP.net datetime format confusion,124066
What do you put in your webservice?,124055
Is MEF a replacement for System.Addin? [duplicate],124040
Are ruby command line switches -rubygems & -r incompatible?,124035
SQL Server Management Studio 2005 - Change Default Directory for Backup Location,124031
How to overcome vs_needsnewmetadata error in Data Flow task?,124005
"Why is software support for Bidirectional text (Hebrew,Arabic) so poor? [closed]",124002
How can I tell if a DOM element is visible in the current viewport?,123999
QueryString malformed after URLDecode,123994
how to determine USB Flash drive manufacturer?,123986
Is there a better way to get hold of a reference to a movie clip in actionscript using a string without eval,123979
URL Encryption in Java,123976
How to get/set logical directory path in python,123958
Convert WPF to PDF,123947
"What causes ""Invalid advise flags"" run-time error in Excel VBA?",123945
Do you use special comments on bug fixes in your code?,123936
How to find USB drive letter?,123927
Automatic newlines and formatting for blogging software,123920
How can one simplify network byte-order conversion from a BinaryReader?,123918
C# Download all files in HTTP directory,123911
How do I sign a Java applet using a certificate in my Mac keychain?,123902
"Ways to do ""related searches"" functionality",123900
Where can I find good Domain Driven Design resources? [closed],123886
Delaying an exception,123862
What's the best way to develop against WordPress on Windows when you already have IIS/SQL Server installed?,123848
Is there an alternative to SVCUTIL.EXE for generating WCF Web service proxies? [closed],123842
Get the resolution of a jpeg image using C# and the .NET Environment?,123838
How much process should a single developer follow? Is a formal process too much?,123837
Using mercurial's mq for managing local changes,123826
Which JMS implementation do you use? [closed],123817
Blank Page in JSF,123809
Visual Studio Freezing/TFS Window Might be off screen,123803
Setting placeholder properties from the controller?,123796
Design question: How would you design a recurring event system? [closed],123793
How to make my code run on multiple cores?,123792
Design question: How would you design a messaging/inbox system?,123783
Logging ALL Queries on a SQL Server 2008 Express Database?,123781
Parent.FindControl() not working?,123776
