Question,ID
What Is ASP.Net MVC?,88763
Using jmockit expectations with matchers and primitive types,88743
CPAN/gem-like repository for Objective-C and Cocoa?,88736
Loading DLLs into a separate AppDomain,88717
How to concatenate icons into a single image with ImageMagick?,88711
Reporting Services Deployment,88710
How Does Relational Theory Apply in Ways I can Care About while Learning it?,88703
what's the best app to draw UI wireframes on the mac? (And why) [closed],88691
What's the best way to serialize a HashTable for SOAP/XML?,88682
Best way of getting notifications in SQL Server Reporting Services using Notification Services,88651
Kerberos Delegation for Clients Ouside the Firewall,88646
How do you do performance testing in Ruby webapps?,88629
Best platform for learning embedded programming? [closed],88626
How do you include a JavaScript file from within a SharePoint WebPart?,88618
What algorithm can you use to find duplicate phrases in a string?,88615
How do I split a string containing a math expression into a list?,88613
Structure of a PDF file? [closed],88582
Should I use an exception specifier in C++?,88573
Any problems running SharpDevelop 3.0 and Visual Studio 2008 side by side?,88571
Can regex capture and substitution be used with an Apache DirectoryMatch directive?,88570
How do I create a node from a cron job in drupal?,88566
C++ Derived Class problems,88558
"In Python, how do you take tokenized input such as with the C++?",88554
"Perl: why is the if statement slower than ""and""?",88546
"Business Objects, Validation And Exceptions",88541
Best way to convert a decimal value to a currency string for display in HTML,88522
How to replace $*=1 with an alternative now $* is no longer supported,88518
Throwing exceptions in ASP.NET C#,88490
"When is a browser considered ""dead""? [closed]",88489
Getting a DrawingContext for a wpf WriteableBitmap,88488
Tell if a Javascript function is defined by looking at self[name] - is this a good way?,88485
Can Adobe AIR display SVG?,88481
Trying to load files from github through a firewall is impossibly slow. Any suggestions for workarounds?,88476
"How to do a ""where in values"" in LINQ-to-Entities 3.5",88473
Is there a plugin in Eclipse for applying tags to files?,88471
KVM/QEMU network TAP problems with libvirt,88460
How do I represent features v. tasks in FogBugz 6?,88455
Is There Any Advantage in Passing a UI wrapper to a view,88454
Flex Framework - How to tell if user is using cached framework?,88448
Project in Ruby,88438
How can I detect if caps lock is toggled in Swing?,88434
"In AIML, what's the XSD-valid way to use the element <set name=""it"">?",88417
ISS error CS0433: name collision,88403
How do I duplicate a whole line in Emacs?,88399
Where do I start learning about GUI programming? [closed],88382
SQLServer tempDB growing infinitely,88381
Is there an elegant way to compare a checkbox and a textbox using ASP.NET validators?,88361
What is the best C# to VB.net converter? [closed],88359
How to get Intellisense on error-marked code in Visual Studio 2005?,88343
Which is better: shipping a buggy feature or not shipping the feature at all?,88339
