Question,ID
Java Frameworks War: Spring and Hibernate,100243
"How do I create a ""select folder OR file dialog window"" in REALbasic?",100242
C# String ASCII representation,100236
Looking for a simple standalone persistent dictionary implementation in C# [closed],100235
"XML schema construct for ""any one or more of these elements but must be at least one""",100228
Tools for finding unused function declarations?,100221
Start seleniumRC from Fitnesse,100216
How to retrieve params from GET HTTP method using javax.ws.rs.* and Glassfish?,100211
What is the standard way to add N seconds to datetime.time?,100210
How can I do offline reasoning with Pellet?,100209
.NET List<T> Concat vs AddRange,100196
Adding a classic ASP webapplication to VS 2008,100187
Best practice for application-icon in windows,100177
What tool/format do you use for writing your specifications? [closed],100174
Is there a way to check if there are symbolic links pointing to a directory?,100170
Is Eclipse 3.4 (Ganymede) memory usage significantly higher than 3.2?,100161
Application wide keyboard shortcut - Java Swing,100123
Causes of getting a java.lang.VerifyError,100107
Obfuscation Puzzle: Can you figure out what this Perl function does? [closed],100106
How to have silverlight get its data from MySQL,100104
What do you consider the best CMS in Java [closed],100089
What's a good threadsafe singleton generic template pattern in C#,100081
Winsock - 10038 Error - Win2K3 Server - baffling behaviour,100074
Why can't I delete a file in %ProgramFiles% from a Unit Test via Resharper's Test Runner Unit Test?,100070
LINQ to SQL insert-if-non-existent,100068
How do you test your web UI to see if it renders uniformly across different browsers?,100058
WCF - Overhead of throwing FaultExceptions within your service,100053
"I need to join two lists, sort them and remove duplicates. Is there a better way to do this?",100048
Regular expressions in C# for file name validation,100045
Facebook RSS application,100038
Logging Application Block - Logging the caller,100007
What are metaclasses in Python?,100003
Self validating binaries?,99999
What tools do you use to implement SOA/Messaging?,99980
General Binary Data Viewer for Windows Vista [closed],99934
OO Javascript : Definitive explanation of variable scope,99927
How do I chain my own JavaScript into the client side without losing PostBack functionality,99917
"VB.Net ""There is a naming violation"" Error with open ldap for creating user",99912
Minimal latency objects pooling technique in multithread application,99907
Count image similarity on GPU [OpenGL/OcclusionQuery],99906
Reading a COBOL DAT file,99897
Generating a unique machine id,99880
Selenium Critique,99876
What's a good f/oss GDI+ (System.Drawing) based graphing and charting component for .NET?,99869
Biggest GWT Pitfalls? [closed],99866
Eclipse text comparison order,99830
Attaching an ID/Label to LINQ to SQL generated code?,99827
What are some useful TextMate shortcuts? [closed],99807
Convert/extract phpinfo() into php.ini,99802
"When to use Binary Space Partitioning, Quadtree, Octree?",99796
