Question,ID
Any issues using an IBM DataPower ESB w/ WCF development?,121827
Setting a key field on a view,121821
How do I replace text inside a div element?,121817
How can I redirect and modify extension-less URLs via ASP.NET?,121813
How do I use Inno Setup to optionally install a plugin/file in a folder based on a registry entry?,121812
Remove Right Click Print Context Menu from Outlook 2007,121810
How to tell if an Excel Workbook is protected,121808
Behaviour-Driven or Test-Driven Development? [closed],121806
What version numbering scheme do you recommend? [closed],121795
Fix for fatal error C1083,121788
What is the STL implementation with the lowest memory footprint?,121787
Sleep a thread until an event is attended in another thread,121762
How do you implement Coroutines in C++,121757
Best practices for SQL Server development across differing versions,121748
"Server virtualization: how to avoid, locate and fix bottlenecks?",121743
Where can I find free WPF controls and control templates? [closed],121724
Getting value from a cell from a gridview on RowDataBound event,121722
Dynamically added JTable not displaying,121715
Preserve file creation date in Subversion,121713
How to use javascript with an asp.net dropdownlist control?,121707
What Exception should be thrown when an ADO.NET query cannot retrieve the requested data?,121700
How can I ensure fopen() won't block when not connected to the network?,121685
What's the difference between 'int?' and 'int' in C#?,121680
"Starting a process in C# with username & password throws ""Access is Denied"" exception",121676
"Multi-Core and Concurrency - Languages, Libraries and Development Techniques [closed]",121674
How to pipe stdout from a groovy method into a string,121665
Implementing User-Controlled Style Changes in ASP.NET,121662
Regular expression to remove XML tags and their content,121656
MVC frameworks on hosted servers,121638
Inner join vs Where,121631
How to tint a UIButton?,121615
Databinding with Silverlight,121606
How to reduce javax.faces.ViewState in JSF,121605
CouchDB backups and cloning the database,121599
Best way of detecting if Windows has Windows Updates ready to download/install?,121585
"Simplest way to create a date that is the first day of the month, given another date",121581
Strange unhandled exception from asp.net application - Validation of viewstate MAC failed,121579
Rails Caching Log Level,121546
"PHP: Use Pecl/Pear, or build my own systems?",121525
How can I integrate a bitbucket repository with the hosted on-demand version of FogBugz?,121521
"Reading XML with an ""&"" into C# XMLDocument Object",121511
Does SPSecurity.RunWithElevatedPrivileges do anything in a console app?,121504
"When a 'blur' event occurs, how can I find out which element focus went *to*?",121499
3DES with .cer public key?,121493
Is there a good way of securing an ASP.Net web service call made via Javascript on the click event handler of an HTML button?,121490
Access running mono application via command line,121476
How to know Flash Player Version from Action Script 3.0,121453
How do I include a stacktrace in my Django 500.html page?,121439
Storing a calendar day in sqlite database,121408
Accessing Object Memory Address,121396
