Question,ID
Parsing Office Documents,115445
WPF and string formatting,115431
How do I convert between time formats?,115428
Algorithm to detect intersection of two rectangles?,115426
How do I get a list of installed CPAN modules?,115425
"Flex profiler gives ""Socket timeout "" error. Why for?",115420
memberInfo.GetValue() C#,115418
Converting a year from 4 digit to 2 digit and back again in C#,115399
Update SQL Server Database Schema with software update,115389
How can I customize the syntax highlighting in Visual Studio 2005?,115388
Do you use source control for your database items? [closed],115369
What is the best way to handle incoming SMS messages?,115361
How can I do Databinding in c#?,115328
How can the error 'Client found response content type of 'text/html'.. be interpreted,115319
How can I consume a WSDL (SOAP) web service in Python?,115316
Does it make sense to mix an RTOS and cyclic executive?,115306
Do you know a good open-source version-control viewer?,115295
How much speed-up from converting 3D maths to SSE or other SIMD?,115291
Which Reporting technology? [closed],115283
error when switching to different svn branch,115281
Fast search in java swing applications?,115277
Refactoring Java factory method,115269
RegisterStartupScript on Logout page,115249
How to disable a programmatical breakpoint / assert?,115237
Can I safely edit a renamed file in perforce,115222
How to check whether a file is valid UTF-8?,115210
Codesmith resources,115206
How to add /usr/share/java libs to webapp's classpath?,115203
Does the MVC pattern describe Roles or Layers?,115198
Does it matter which vendor's JDK you build with?,115184
How do I do table sorting using CodeIgniter?,115167
When should I use # and = in ASP.NET controls?,115159
Strategies for Caching on the Web? [closed],115126
What are your experiences with Windows Workflow Foundation?,115124
no respond_to block in edit action (generated with scaffold)?,115121
Should unit test classes be kept under version control with the rest of the code?,115116
Test Automation with Embedded Hardware,115115
Use VBA in Office 2007 Applications?,115108
How do you implement position-sensitive zooming inside a JScrollPane?,115103
CVS: Replace HEAD with a branch,115098
How do I prevent TFS from overwriting a label?,115096
Retrieve Web Browser Stored Form Data?,115095
MVC Preview 5 - Rendering A View To String For Testing,115060
What is the format of the Remap XML file for IKVM?,115041
Is there any reason to not use my IoC as a general Settings Repository?,115039
An Issue with converting enumerations in C++\CLI,115031
Keep sources from external repositories up-to-date,115021
How can we print line numbers to the log in java,115008
"How can I generate ""migration"" DDL from NHibernate mapping files?",115001
PHP and MS Access,114996
