Question,ID
Virtual member call in a constructor,119506
Difference between Visual C++ 2008 and 2005,119492
Getting Security Headers into a WCF service with custom message/formatter in .NET 3.0,119478
SQL Server 2005 / XML Stored Proc - Unicode to ascii? (Exception 0xc00ce508),119477
Is it possible to create full screen color overlay effects in windows?,119471
How do you structure your URL routes?,119467
How do you make the background of a video or picture clear in Quartz Composer?,119462
Locking binary files using git version control system,119444
Highlight a word with jQuery,119441
Logging Clientside JavaScript Errors on Server [closed],119432
Jar file naming conventions,119426
How would you unittest a memory allocator?,119414
time length of an mp3 file,119404
How well does Python's whitespace dependency interact with source control with regards to merging?,119399
Source code control policy,119396
Generate Dynamic Excel from Java,119392
What is the best search approach?,119391
Specify the from user when sending email using the mail command,119390
How to customize directory structure in ASP.NET MVC?,119388
How to disable annoying 'parenthesis completion'?,119387
Rails performance analyzers,119349
ssl_error_rx_record_too_long and Apache SSL [closed],119336
"How do I truncate a java string to fit in a given number of bytes, once UTF-8 encoded?",119328
How to pass context around in a ASP.NET MVC web app,119324
URLs: Dash vs. Underscore [closed],119312
How do I get a list of tables affected by a set of stored procedures?,119308
Pass-through authentication for MS SQL 2005 DB from SharePoint?,119295
Catching line numbers in ruby exceptions,119286
Position the caret in a MaskedTextbox,119284
How do you copy a PHP object into a different object type,119281
Row numbers for a query in informix,119278
Copy all files and folders using MSBuild,119271
How can I make Loadtime-AspectJ to work in applet,119245
"In .Net, what is the fastest way to recursively find all files from a root directory?",119242
PHP unserialize keeps throwing same error over 100 times,119234
What does 'yield called out of block' mean in Ruby?,119207
Migrate clearcase to perforce,119204
Is it good to switch from c# to python? [closed],119198
The Rails Way - Namespaces,119197
What tools allows me to keep track of html tags when doing web development?,119180
Add row while assigning datasource for datagridview,119168
Adding code to __init__.py,119167
What is the difference between Events with Delegate Handlers and those without? [duplicate],119160
Will it be faster to use several threads to update the same database?,119157
Vista not allowing one .exe to call another .exe,119146
Why isn't sizeof for a struct equal to the sum of sizeof of each member?,119123
Extract an RT_RCDATA section from a Win32 executable (preferably in C#)?,119117
Server Generated web screenshots?,119116
Conditional compilation for working at home,119114
How do I generate a list of n unique random numbers in Ruby?,119107
