Question,ID
Can IIS7 be installed on XP?,108432
Does anyone know of a good MAML editor [closed],108429
How can I compile Asp.Net Aspx Pages before loading them with a webserver?,108405
Solutions for INSERT OR UPDATE on SQL Server,108403
What embedded database with Isolated Storage support can you recommend?,108399
Fluent NHibernate Many-to-Many,108396
Is it a good (correct) way to encapsulate a collection?,108389
Apache and IIS side by side (both listening to port 80) on windows2003,108387
best way to get started in setting up Mono for ASP.NET on Mac,108380
Checking for external dependances in vb.net,108346
Code behind in ASP.NET MVC,108320
How can I test whether a number is a power of 2?,108318
"Is ""do not load this page directly"" really necessary in PHP?",108301
GWT or DOJO or something else?,108294
How to send clean email messages from your application?,108292
Can I refactor my MySQL queries into one query based on number of results?,108281
How to play a sound in Actionscript 3 that is not in the same directory as the SWF?,108276
"Should a novice programmer spend time learning to write ""desktop"" applications these days, or is the web where it's at? [closed]",108272
Subclassed form not behaving properly in Designer view (VS 2008),108270
"What could be the causes of ""permission denied"" for tty1?",108251
Add a column to existing table and uniquely number them on MS SQL Server,108211
How do I make an HTML text box show a hint when empty?,108207
Best way to extract a timezone from a mail Date header in Java?,108200
Union and Intersect in Django,108193
How to prevent SIGPIPEs (or handle them properly),108183
Hibernate 3: unable to query PostgreSQL database,108171
How do I take a slice of a list (A sublist) in scheme?,108169
What is the best way to replace the file browse button in html?,108149
InstallShield: FilterProperty column of ISComponentExtended table?,108135
How to apply bold style to a specific word in Excel file using Python?,108134
MEF (Managed Extensibility Framework) vs IoC/DI,108116
How do I convert a System.Type to its nullable version?,108104
How does VxWorks deal with priority inheritance?,108098
Disabling single line copy in Visual Studio,108094
Flex - best strategy for keeping client data in synch with backend database?,108089
Best practices for detecting DOS (denial of service) attacks? [closed],108088
"Are there any High Level, easy to install GUI libraries for Common Lisp? [closed]",108081
struts action controller - multithreaded?,108059
How do you diagnose a leak in C memory caused by a Java program?,108057
MOSS 2007: BDC permisson problem - no BDC application is listed in the web part's configuration menu,108051
Whats the best Ribbon UI control to retro fit to a legacy MFC application build with VC2005?,108047
"Closing/cleaning up ""mixed"" file descriptors / sockets",108043
What is Cloud computing? [closed],108037
Weather web service for Europe? [closed],108025
Parse multiple XML files with ASP.NET (C#) and return those with particular element,108010
PLY: Token shifting problem in C parser,108009
How can I get the filetype icon that Windows Explorer shows?,108005
Optimal multiplayer maze generation algorithm,108000
How do you recursively unzip archives in a directory and its subdirectories from the Unix command-line?,107995
Toad unicode input problem,107984
