Question,ID
Flush disk write cache from Windows CLI,85595
FindControl() method throws ArithmeticException?,85588
Search for host with MAC-address using Python,85577
.Net (dotNet) wrappers for OpenCV? [closed],85569
VB.NET 2005 problems with Designer not being able to process a code line,85559
When should I use a struct instead of a class?,85553
"How to make Swing scroll with ""ensureIndexIsVisible""?",85548
Faces Servlet threw exception java.lang.StackOverflowError,85532
Migrating from MySQL to arbitrary standards-compliant SQL2003 server,85522
PHP DOMDocument stripping HTML tags,85520
TileBrush for SIlverlight 2?,85517
"What does the option ""convert to web application"" do if I select it in visual studio?",85513
AJAX - How to Pass value back to server,85500
Reverse DNS lookup in perl,85487
Adding a SVN repository in Eclipse,85486
How can I return the content of an XML field as a recordset?,85481
C# Unsafe/Fixed Code,85479
MVC C# custom MvcRouteHandler - How to?,85470
Is it possible to combine a series of PDFs into one using Ruby?,85459
Limiting results of System.Data.Linq.Table<T>,85457
Python's time.clock() vs. time.time() accuracy?,85451
SQL Server 2005 Linked Server to DB2 Performance issue,85450
Sharepoint Item Level Access & performance,85444
"Code Outlining, Classic ASP and Visual Studio 2005",85434
Rich Edit Control in raw Win32,85427
How do you port a virtual machine from VMWare to VirtualBox?,85414
Generating a PDF document based on a Microsoft Word Template [closed],85404
how to change default delete date in lotus notes for emails?,85403
SharePoint - How do insert new items using the list web service?,85392
World's First Computer Programming _Language_? [closed],85374
Floor a date in SQL server,85373
"Most common cause of ""java.lang.NullPointerException"" when dealing with XMLs?",85370
Best general SVN Ignore Pattern?,85353
Customizing Search Results Display in Sharepoint Services 3.0 Wiki,85336
Handling and storing elapsed time,85307
How to avoid garbage collection in real time .NET application?,85283
What is the value of an anonymous unattached block in C#?,85282
How do I enable more than 8-bit colors in Terminal.app?,85277
How do I derive a Voronoi diagram given its point set and its Delaunay triangulation?,85275
How do you know when to use design patterns? [closed],85272
JConsole Config,85254
Which language is useful to create a report for a valid C program [closed],85230
How to manually parse a floating point number from a string,85223
Linking .Net Assemblies,85222
Best way to version control T-SQL? [duplicate],85195
"In detail, how does the 'for each' loop work in Java?",85190
mysqldump equivalent for SQL Server,85186
Windsor Container: How to force dispose of an object?,85183
I traced a Stored Procedure as shown in the SQL Server 2005 Profiler. It's not found but works. Why?,85181
Fix argument handling in SQL Server 2005 Mgmt Studio custom Keyboard Accelerator shortcuts?,85179
