Question,ID
Calling C# events from outside the owning class?,107972
A Firefox javascript bookmarking problem,107971
CSS list-style: none; still shows bullet,107964
How to add some non-standard font to a website?,107936
Is it feasible to introduce Test Driven Development (TDD) in a mature project? [closed],107919
"How to create a zip file in the same format as the Finder's ""Compress"" menu item?",107903
Is there a Windows/MSVC equivalent to the -rpath linker flag?,107888
Identifying if 2 HTML pages are similar,107884
What's the best source-level debugger for ColdFusion MX 2004? [closed],107878
How can I integrate Laconica update stream into SharePoint?,107872
Maximum lines of code permitted in a Java class?,107855
Connectionstring error after encrypted using aspnet_regiis.exe [closed],107846
How to display latest revision in a file?,107840
How can I turn on PHP errors display on just a subfolder,107828
Why is my Java program leaking memory when I call run() on a Thread object?,107823
Can Flash save content without server-side help?,107800
Importing/exporting history from SVN to TFS,107794
What are good sources to study the threading implementation of a XMPP application?,107772
C# libraries for internationalization?,107755
How to overcome StackOverflowException bypassing unhandled exception handling in .NET,107735
Disable output buffering,107705
How can I Remove .DS_Store files from a Git repository?,107701
global variables in php not working as expected,107693
When and why should $_REQUEST be used instead of $_GET / $_POST / $_COOKIE?,107683
How can I unit test responses from the webapp WSGI application in Google App Engine?,107675
Backend administration in Ruby on Rails,107674
What do you use when you need reliable UDP? [closed],107668
How to compute the critical path of a directional acyclic graph?,107660
XML-RPC: best way to handle 64-bit values?,107616
How can i temporarily load a font?,107611
Is there still any reason to learn AWK? [closed],107603
Point Sequence Interpolation,107598
Unit testing MFC UI applications?,107591
Problem calling stored procedure from another stored procedure via classic ASP,107585
Where should you enable SSL?,107566
Trying to run faac's bootstrap script but running into errors,107562
Whats the best way to get started with server virtualization?,107552
GCC compiling a dll with __stdcall,107549
How would you implement auto-capitalization in JavaScript/HTML,107546
How do you prototype? [closed],107534
XML based website - how to create?,107531
Is JavaScript object-oriented?,107464
What's the best way to do a mapping application for the iPhone,107456
What's your best trick to break out of an unbalanced quote condition in BASE SAS?,107414
Best way to translate mouse drag motion into 3d rotation of an object,107413
How do you send a HEAD HTTP request in Python 2?,107405
What are the down sides of using a composite/compound primary key?,107404
What's the difference between a POST and a PUT HTTP REQUEST?,107390
Regex index in matching string where the match failed,107382
I need populate a repeater with pseudo-related data,107329
