Question,ID
"Is there any list of blog engines, written in Django?",82653
Best way for allowing subdomain session cookies using Tomcat,82645
Can you use Microsoft Entity Framework with Oracle? [closed],82644
"Differences between NHibernate, Castle, Linq - Who are they aimed at?",82632
Information about how many files to compile before build in Visual Studio,82612
Python + DNS : Cannot get RRSIG records: No Answer,82607
Best server-side framework for heavy RIA based application? [closed],82599
Boost serialization: specifying a template class version,82550
svn over HTTP proxy [closed],82530
"Reviews for programmable, tiling window manager ion3",82518
Is it possible to drag and drop from/to outside a Flash applet with JavaScript?,82509
Has anyone tried transactional memory for C++?,82495
How to catch ALL exceptions/crashes in a .NET app [duplicate],82483
Perforce. Getting the file status in the sandbox,82468
What impact (if any) does Delphi 2009's switch to Unicode(/UTF16) have on executable size and memory footprint?,82454
Extension Methods not working for an interface,82442
Big PDF file when language is PL (Polish),82441
Why is it impossible to override a getter-only property and add a setter?,82437
Hosting a website on your own server,82431
"When Hibernate flushes a Session, how does it decide which objects in the session are dirty?",82429
Change report data visibility based on rendering format in Reporting Services,82417
Prefetch instructions on ARM,82415
Is there a way to override the empty constructor in a class generated by LINQtoSQL?,82409
WAITFOR command,82404
How to match URIs in text?,82398
Should Tables be avoided in HTML at any cost? [duplicate],82391
Best way to handle URLs in a multilingual site in ASP.net,82380
Smooth ProgressBar in WPF,82365
Web Site or Web Application in ASP.NET,82361
"In Struts 1.3, what's the best way for the Controller to fill the View with variables?",82359
Way to Alt-Tab through all applications in Virtual and Host PC,82350
How do I read only x number of bytes of the body using Net::HTTP?,82349
Charting in web-based applications,82345
Is there a way to specify a different session store with Tomcat?,82340
Using CreateItemFromTemplate to process an olEmbeddeditem Outlook attachment,82332
How to Set Grid Column MaxWidth depending on Window or Screen Size in XAML,82323
How can I determine the length (i.e. duration) of a .wav file in C#?,82319
Is it possible to build a Linux/Motif Eclipse RCP application?,82305
Placing Share Documents subfolder as a webpart in SharePoint,82286
How do I use the same field type in multiple lists on SharePoint?,82269
Tools for command line file parsing in cygwin,82268
Launch Local Mail Client from App Hosted on Citrix,82266
pseudo-streaming of wmv files,82264
HTML drag and drop sortable tables,82259
How do I use sudo to redirect output to a location I don't have permission to write to? [closed],82256
Testing StarTeam operations,82245
"Is there a Problem with JPA Entities, Oracle 10g and Calendar Type properties?",82235
"Force IIS7 to suggest downloading *.exe files in ""Local intranet"" zone",82232
Is it worth the effort to move from a hand crafted hibernate mapping file to annotaions?,82223
How do I use calculated value date in Sharepoint lists field to find a date+30 days?,82220
