Question,ID
Is there any way to inherit the existing TLD definition for particular JSP Tag?,113765
Can you render a Direct3D window for one process into another process' HWND?,113758
Programmatically add an application to Windows Firewall,113755
How do I cancel a text selection after the initial mousedown event?,113750
"How do I use PowerShell to stop and start a clustered ""Generic Service""?",113737
CruiseControl.NET post-build actions,113731
How do I run a script when ip-address changes (most likely using a dhclient hook) on a (Ubuntu) Linux machine?,113730
PHP webpage doesn't launch unix command even after updated sudoers,113728
Simple database application for Windows,113723
I'm looking for publications about the history of the internet browsers [closed],113717
LocBaml include previous translations,113712
"How do I add a ""last"" class on the last <li> within a Views-generated list?",113702
How not to repeat yourself across projects and/or languages,113696
Hiding toolbar / status bar with javascript in CURRENT browser window?,113682
Installing PowerShell on 600 client computers - Recommended settings,113664
Is there a function in python to split a word into a list? [duplicate],113655
VS 2003 CrystalReports - details section issue,113645
Property Grid Object failing on combo box selection but OK when combobox scrolled or double clicked,113644
File format of CF10-jpg,113641
Which CSS tag creates a box like this with title?,113640
"jBPM, concurrent execution and process variables",113626
Why is ENUM better than INT,113609
Getting user name/password of the logged in user in Windows,113592
Attaching Informix .dat and .idx files,113582
How to read a barcode from an image [closed],113571
Why Re-throw Exceptions?,113565
What is the best Linux distribution for Vmware server? [closed],113561
iPhone development on Windows [duplicate],113547
Role Based Access Control,113543
How can I uninstall an application using PowerShell?,113542
Is there a function in Python to split a string without ignoring the spaces?,113534
Running SQL Server on the Web Server,113531
Potential legal issues with storing Social Security/Insurance Numbers (SSNs/SINs)? [closed],113526
Best implementation for hashCode method for a collection,113511
Including a WebService reference in a control,113507
Bad reference to an object already freed,113504
"Windows Performance Counter Port to Linux, HP-UX and AIX",113498
Getting IIS6 to play nice with WordPress Pretty Permalinks,113489
When to enable/disable Viewstate,113479
Java User Interface Specification,113464
Displaying code in blog posts [closed],113440
"iPhone application : is-it possible to use a ""double"" slider to select a price range",113437
How to clear the scrollback in the screen command?,113427
How do I connect to a USB webcam in .NET? [closed],113426
Converting Reverse Polish Notation,113424
Good Secure Backups Developers at Home [closed],113423
How can I test for an expected exception with a specific exception message from a resource file in Visual Studio Test?,113395
Dynamically added controls in Asp.Net,113392
"What's the relationship between margin, padding and width in different browsers?",113387
Declare an object even before that class is created,113385
