Question,ID
What is the recommended version of GNU autotools?,106405
Can Spring Parse and Inject Properties Files?,106402
Validate an incoming SOAP request to the WSDL in PHP,106401
"Fetch top X users, plus a specific user (if they're not in the top X)",106400
Accessing an image in the projects resources?,106396
Flash toggle snapping,106395
Is it possible to detect 32 bit vs 64 bit in a bash script? [duplicate],106387
C# - Can publicly inherited methods be hidden (e.g. made private to derived class),106383
Getting multiple UI threads in Windows Forms,106378
Add non-ASCII file names to zip in Java,106367
What tools do you use to monitor a web service?,106358
Secure a DLL file with a license file [closed],106347
How do I find out what type each object is in a ArrayList<Object>?,106336
How do you programmatically identify the number of references to a method with C#,106329
Is there a case where delegate syntax is preferred over lambda expression for anonymous methods?,106324
SQLPlus settings to generate tab-separated data file,106323
How can I best connect Seam and GWT in a stateful web application?,106310
How do I plan an enterprise level web application? [closed],106299
What is causing a stack overflow?,106298
"What is the most stable, least intrusive way to track web traffic between two sites?",106285
How to get a distinct list of words used in all Field Records using MS SQL?,106275
How do I write a custom validation method with parameters for my ActiveRecord model?,106251
How do I synchronize the address book in my app using MAPI?,106243
Calculate the Hilbert value of a point for use in a Hilbert R-Tree?,106237
lsof survival guide [closed],106234
What does OSGi solve?,106222
Fastest way to remove non-numeric characters from a VARCHAR in SQL Server,106206
How can I run an OpenGL application installed on a linux machine from my windows machine?,106201
Regular expression to match DNS hostname or IP Address?,106179
VB.NET - How to get the instance used by a With statement in the immediate window,106175
ClickOnce Online-Only Application as a TS RemoteApp,106164
Where do you put your CSS Margins? [closed],106137
Tools to enable translation of A-Box ontology data [closed],106134
"GCC - ""expected unqualified-id before ')' token""",106117
Popup Window similar to Modal Window,106112
What's the Meaning of and Fix for the Error 'The Controls Collection cannot...',106095
"In MATLAB, can a class method act as a uicontrol callback without being public?",106086
How to create an AxHost solely in code [C#],106081
regular expression to replace two (or more) consecutive characters by only one?,106067
Practical example of Lisp's flexibility? [closed],106058
QDrag destroyed while dragging,106056
How can I make a batch file to act like a simple grep using Perl?,106053
Best approach to web service powered by a daemon,106045
how can I debug exe with soem switch flags from command prompt,106038
How do I Yield to the UI thread to update the UI while doing batch processing in a WinForm app?,106036
How do I call a .NET assembly from C/C++?,106033
Parameterized SQL Columns?,106001
Which SharePoint 2007 features are not available to Office 2003 users?,106000
How do I get the value of the jdbc.batch_size property at runtime for a Web application using Spring MVC and Hibernate?,105998
How to get scientific results from non-experimental data (datamining?),105996
