Question,ID
grails plugin for eclipse and netbeans 6.1,121393
How to determine the line ending of a file,121392
Fetch the rows which have the Max value for a column for each distinct value of another column,121387
What are the key aspects of a strongly typed language?,121385
Is there a way to comment out markup in an .ASPX page?,121382
Built-in localization tools in VS2008,121373
WCF Routing Message Security,121354
Point ADO.Net DataSet to different databases at runtime?,121350
"What does the GDB backtrace message ""0x0000000000000000 in ?? ()"" mean?",121326
A Java API to generate Java source files [closed],121324
Unix Script reading a specific line and position,121318
Read in an XML String with Namespaces for Use in an XSL Transformation,121309
Test accounts and products in a production system,121306
Separating Web Applications into multiple projects,121283
Why do my keystrokes turn into crazy characters after I dump a bunch of binary data into my terminal?,121282
How do I detect what browser is used to access my site?,121280
Is it possible to bind complex type properties to a datagrid?,121274
Testing a JAX-RS Web Service?,121266
"""Pending checkins"" window stuck; never finishes updating",121253
Best StAX Implementation [closed],121251
Using customBuildCallbacks.xml in an Eclipse RCP headless build,121244
Hidden Features of SQL Server,121243
How to do unsigned saturating addition in C?,121240
How do you convert a string to a node in XQuery?,121237
Visual Studio ClickOnce deployment - certificate expiration,121223
Client-side detection of HTTP request method,121218
JMXQuery connection - authentication failed,121205
How to detect if JavaScript is disabled?,121203
Automatically folding #defines in vim,121202
Surround with quotation marks,121199
Is There Still A Case For MFC,121184
Configure trac for anonymous ticket submissions,121169
Hidden features of Greasemonkey [closed],121167
What does the explicit keyword mean?,121162
Determine if a directory is a bundle or package in the Mac OS X terminal?,121147
Securing a Web Service,121123
Keyboards with the number pad in the middle? [closed],121119
"Country, State, Province WebService? [closed]",121117
How to get the executable path from a Managed DLL,121116
Slow treeview in C#,121112
"How do I keep Visual Studio from autoraising, when I activate ""Focus Follows Mouse""?",121111
Good Resource Loading System,121110
Multi-select in the prompt is not working properly in Cognos 8.1,121105
Event handling jQuery unclick() and unbind() events?,121066
Why can't VS2008 place an exception helper popup onto a secondary monitor?,121063
Conversion from 32 bit integer to 4 chars,121059
iPhone Full Screen Image,121051
How do I get the modified date/time of a file in Python? [duplicate],121025
Is it possible to develop for the iPhone without an iPhone?,121018
"Stuck creating a ""security trimmed"" html.ActionLink extension method",121000
