Question,ID
Encoding spaces with the javascript encodeURIComponent function,101422
Multiple local connections in flash - what's the better architecture?,101416
Thumbnail image from .3gp file [closed],101415
What are the best open source Nagios interfaces? [closed],101414
Is there any free tool for monitoring BizTalk applications remotely? [closed],101394
Dynamic class variables,101386
How do I do Dependency Injection in a test project (TFS 2008) using Castle,101363
How do you generate passwords? [closed],101362
What's the best way to port an application from ActionScript2 to ActionScript3?,101347
Is it valid to have a 'choice' of 'group' elements when defining an XML Schema (XSD),101338
What is the difference between a non-secure random number generator and a secure random number generator?,101337
The ultimate MySQL legacy database nightmare,101333
"If classes with virtual functions are implemented with vtables, how is a class with no virtual functions implemented?",101329
IIS Wildcard Mapping not working for ASP.NET,101326
"How to manage concurrent Input/Output access to a XML file from multiple instances of an EXE, using Delphi.",101316
IronClad equivalent for Jython,101301
"If I were to build a new operating system, what kind of features would it have? [closed]",101294
How many bits are there in a nibble?,101290
Big things to do when deploying a rails app,101275
Vim errorformat for Visual Studio,101270
Hidden features of Python [closed],101268
Is there any way to define a constant value to Java at compile time,101267
Why is there no ForEach extension method on IEnumerable?,101265
"In Vim, is there a way to paste text in the search line?",101258
What command(s) control the behavior of /etc/rc*.d on Redhat/CentOS?,101244
Letting several assemblies access the same text file,101238
Programmatically exclude page items in olap pivot,101223
Is there a more user friendly alternative to Net::HTTP for interacting with REST APIs?,101212
How can I confirm a database is Postgres & what version it is using SQL?,101198
Triggering a .NET garbage collection externally,101196
Hudson FindBugs plugin: how make the job fail if any problems?,101195
How can I confirm a database is Oracle & what version it is using SQL?,101184
MOSS 2007 Crawl,101182
Which is the best .Net XML-RPC library?,101180
Is there a zip-like method in .Net?,101174
SQL Server 2005 Fulltext indexing prevents backups,101168
JSON and ASP.NET MVC,101162
Count images in some folder on WEB server (ASP.NET),101156
What is the unit testing strategy for method call forwarding?,101151
Anything better than PHPDoc out there? [closed],101146
Check if XML Element exists,101145
How do I read text from the Windows clipboard in Python?,101128
Force browser to use new CSS,101125
CSV API for Java [closed],101100
How you setup a greenfield project,101099
How to move mails from one linked Exchange mailbox to another in MS Access,101096
SQL Server Management Studio – tips for improving the TSQL coding process,101079
Java: Why aren't NullPointerExceptions called NullReferenceExceptions?,101072
What is an ideal variable naming convention for loop variables? [closed],101070
What little things do I need to do before deploying a rails application,101066
