Question,ID
How do I implement a two-pass scanner using Flex?,104967
Are there any ORM tools for Haskell?,104960
Inspecting STL containers in Visual Studio debugging,104959
Testing Abstract Class Concrete Methods,104958
Position an element relative to its container,104953
I want tell the VC++ Compiler to compile all code. Can it be done?,104952
Web designer for VS.NET ReportViewer,104951
Is there a .NET performance counter to show the rate of p/invoke calls being made?,104920
Command Pattern : How to pass parameters to a command?,104918
Sharing binary folders in Visual Studio,104901
How do I remove loadbalancer pollution from my access logs,104892
Dealing with the rate of change in software development,104890
Automating interaction with a HTML game using C#?,104878
"PHP :: Emulate <form method=""post"">, forwarding user to page",104872
Looking for C# registry class [closed],104866
"""SetPropertiesRule"" warning message when starting Tomcat from Eclipse [duplicate]",104854
Test if string is a guid without throwing exceptions?,104850
Default Printer in Unmanaged C++,104844
Rails Sessions over servers,104837
Winform application profiling CPU usage / spikes .,104831
Reduce startup time of .NET windows form app running off of a networked drive,104815
How do you create automated tests of a Maven plugin using JUnit?,104803
Why aren't Java Collections remove methods generic? [duplicate],104799
WCF service for receiving image,104797
Direct Path Load of TimeStamp Data With SQL*LDR,104791
Asp.net c# and logging ip access on every page and frequency,104764
How to determine order for new item?,104747
Web application to user instant messaging,104733
Are there native compilers for functional programming languages [closed],104725
"Why should events in C# take (sender, EventArgs)?",104674
Specific Client Detection based on headers. Firefox extension?,104665
What was the first version of MS Office to officially support Unicode?,104661
How can I disable the eclipse server startup timeout?,104640
Any good SQL Anywhere database schema comparison tools?,104620
What does -> mean in F#?,104618
What is a good tutorial/howto on .net / c# socket programming [closed],104617
Run MySQLDump without Locking Tables,104612
Accessing a Collection Through Reflection,104603
Response.Redirect to new window,104601
Sort on a string that may contain a number,104599
What's a good alternative to security questions? [closed],104592
How to configure ResourceBundleViewResolver in Spring Framework 2.0,104587
Does the iPhone SDK allow hardware access to the dock connector?,104583
CVS and Visual Studio 2008 - integration options,104579
Accessing Greasemonkey metadata from within your script?,104568
Do I have always use .css files?,104550
Warm SQL Backup,104525
WPF Validation for the whole form,104520
Calling PHP functions within HEREDOC strings,104516
What's the best freely available C# wrapper for BITS? [closed],104505
