Question,ID
CSS to select/style first word,55612
JavaScript private methods,55611
Best Technique for Multiple Eval Fields in Gridview ItemTemplate?,55607
CSS not being applied on non authenticated ASP.NET page,55594
How can I test my web pages in Microsoft Internet Explorer on a Mac?,55577
"ASP.Net: If I have the Session ID, Can I get the Session object?",55576
Learning Ruby on Rails,55574
live asp.net web.config settings,55572
Characters to avoid in automatically generated passwords [closed],55556
Casting between multi- and single-dimentional arrays,55532
"How do I calculate the ""cost"" of a crash? [closed]",55531
Very slow compile times on Visual Studio 2005,55517
When do function-level static variables get allocated/initialized?,55510
How do I conditionally create a stored procedure in SQL Server?,55506
How do I logout of multiple asp.net applications?,55503
Return collection as read-only,55502
Find the settings JNDI is using for error reporting,55487
Uninstall Command Fails Only in Release Mode,55482
Should I use one big SQL Select statement or several small ones?,55463
What is the possible mimetype hierarchy of an email message?,55460
Which C# project type would you use to redevelop a MFC C++ activex control?,55451
"Can you ""ignore"" a file in Perforce?",55449
What’s the best approach when migrating legacy projects across versions of visual studio?,55448
Checking Inheritance with templates in C++,55440
Using Microsoft's Application Blocks,55437
How to parse relative time?,55434
Do you actively manage technical debt? [closed],55421
ASP.NET MVC versus the Zeitgeist,55414
Path.GetTempFileName -- Directory name is invalid,55411
Have you successfully used a GPGPU? [closed],55403
Python regular expression for HTML parsing,55391
ant build.xml windows white space in path,55386
Extending an enum via inheritance,55375
Reading VC++ CArchive Binary Format (or Java reading (CObArray)),55369
How can I get Emacs' key bindings in Python's IDLE?,55365
__doPostBack is not working in firefox,55360
"""Background"" task in palm OS",55350
How can I kill all sessions connecting to my oracle database?,55342
Bespoke SQL Server 'encoding' sproc - is there a neater way of doing this?,55340
How do I maintain position of a DragPanelExtender across postbacks?,55330
ASP.NET Web Application Build Output - How do I include all deployment files?,55323
JVM choices on Windows Mobile,55322
OpenGl And Flickering,55317
Automatic code quality tool for Ruby? [closed],55313
"asp consuming a web service, what do do with recordset object?",55297
How exactly do you configure httpOnly Cookies in ASP Classic?,55296
Kill a specific PHP script running on FastCGI / IIS?,55279
What are the advantages of VistaDB,55273
Refresh all update panels on the page?,55270
Files on Windows and Contiguous Sectors,55256
