Question,ID
Remote installing of windows service,62501
Similarity between line strings,62496
How to create J2ME midlets for Nokia using Eclipse,62491
How can I get Axis 1.4 to not generate several prefixes for the same XML namespace?,62490
Any PHP editors supporting 5.3 syntax? [closed],62472
How to spread tcplistener incoming connections over threads in .NET?,62449
tomcat5 fails to start on CentOS 5 with NoClassDefFoundError exception,62447
How do I prevent Flash's URLRequest from escaping the url?,62437
DevExpress eXpressApp Framework (XAF) and eXpress Persistent Objects (XPO): how do I speed up the loading time of associations?,62436
How do I write Facebook apps in Java?,62433
Regular expression that rejects all input?,62430
How to update large XML file,62423
Knowing which java.exe process to kill on a windows machine [closed],62418
Alternative Style(CSS) methods in SAP Portal?,62406
What technical considerations must a system/network administrator worry about when a site gets onto social bookmarking/sharing sites?,62403
What are the best practices for the Middleware API? [closed],62398
What are the differences between Visual C++ 6.0 and Visual C++ 2008?,62389
How to convert Apache .htaccess files into Lighttpd rules?,62384
Can you animate a custom dependency property in Silverlight?,62382
Using reflection to call an ASP.NET web service,62365
What are the best practices for using Assembly Attributes?,62353
Does pop_back() really invalidate *all* iterators on an std::vector?,62340
What's a liquid layout?,62334
Is there an algorithm that tells the semantic similarity of two phrases,62328
Asynchronous APIs,62322
PHP: How to expand/contract Tinyurls,62317
How to modify the default Check-in Action in TFS?,62294
Are liquid layouts still relevant?,62292
Read/write to Windows registry using Java,62289
Java package cycle detection: how do I find the specific classes involved? [closed],62276
"Error consuming Web Service from Winform App - ""Cannot execute a program...""",62268
Dealing with SVN keyword expansion with git-svn,62264
Merging records for Mnesia,62245
How to convert a Reader to InputStream and a Writer to OutputStream?,62241
How to view web pages at different resolutions,62232
How to save jpg image to database and then load it in Delphi using FIBplus and TImage?,62230
How do I access class variables of a parent object in PHP?,62226
Classis ASP debugging global.asa in VS2005,62225
Is there any way to get rid of the long list of usings at the top of my .cs files?,62219
How (and whether) to populate rails application with initial data,62201
What's the shortest code to cause a stack overflow? [closed],62188
Where can I find a QR (quick response) Code component/API for Windows Mobile?,62173
Would you bother to mock StreamReader object?,62159
Response.Clear in ASP.NET 3.5,62154
Reasons not to build your own bug tracking system [closed],62153
DateTime.Now vs. DateTime.UtcNow,62151
Does anyone have a handy visulization widget that I can use for a web project? [closed],62146
What is a Covered Index?,62137
How can I find the current DNS server?,62127
ADO.NET Entity Framework tutorials [closed],62110
