Question,ID
asp:UpdateProgress - suppressing the line-break,42499
TFS - Branching for experimental development: Solution fails to load,42490
"How to implement a ""related"" degree measure algorithm? [closed]",42489
Simulated OLAP,42483
Best way to extract text from a Word doc without using COM/automation? [closed],42482
How do I measure bytes in/out of an IP port used for .NET remoting?,42468
MSDN subscriptions on the cheap? [closed],42466
Custom titlebars/chrome in a WinForms app,42460
Is BCEL == monkeypatching for java?,42452
How do I convert an IntPtr to a Stream?,42446
What's the best way to detect the presence of SMO?,42438
"Best way to handle input from a keyboard ""wedge""",42437
Window managers for Windows and Macs [closed],42428
Is reusing a variable in VB6 a good idea?,42422
How can I install libgluezilla on Ubuntu 8.04?,42416
How do I implement OpenID in my web application?,42407
ASP.Net: why is my button's click/command events not binding/firing in a repeater?,42396
How do I write a While loop [closed],42395
What is the C# equivalent of the Oracle PL/SQL COALESCE function?,42386
Java object allocation overhead,42383
What does the EXE do in the Visual Studio setup project output,42366
How do you check your URL for SQL Injection Attacks?,42357
How to evaluate an IP?,42345
IE6 rending UL's incorrectly,42342
How to display a live streaming video using VideoDisplay in Flex,42333
Real image width with JavaScript,42323
Are There Adapters for CF Type II to MicroSD?,42312
Tool to track #include dependencies [closed],42308
How do you get the footer to stay at the bottom of a Web page?,42294
What's the best way to read the contents of a text file to a string in .NET?,42286
Which way do you prefer to create your forms in MVC?,42282
IE6 and Caching,42281
.Net [Windows] TreeView TreeNode does not retain color change after drag and drop,42272
Twitching Consumption of Web Services from Web Site to Web Application,42262
How do you pause before fading an element out using jQuery?,42254
Whither Managed Extensibility Framework for .NET?,42251
Are semicolons needed after an object literal assignment in JavaScript?,42247
Subversion Partial Export,42246
Make a CD run once [closed],42239
Simple effects in Flex,42234
ASP.NET - The request was aborted: Could not create SSL/TLS secure channel,42215
How can I use Linq with a MySql database on Mono?,42212
Where did these hex named folders come from? [closed],42204
SQL Number Formatting,42203
Managing LINQ to SQL .dbml model complexity,42200
How do I determine which process is using a serial port?,42197
How are partial methods used in C# 3.0?,42187
How to escape < and > inside <pre> tags,42182
How to copy the contents of an FTP directory to a shared network path?,42171
If you were programming a calendar in HTML would you use Table tags or Div tags?,42169
