Question,ID
Getting started with Silverlight development,60620
Automate Safari web browser using c# on Windows,60609
"In PHP5, should I use Exceptions or trigger_error/set_error_handler? [closed]",60607
Best way to initiate a download?,60590
PHP Forms-Based Authentication on Windows using Local User Accounts,60585
XmlSerializer - There was an error reflecting type,60573
"Why should the ""PIMPL"" idiom be used? [duplicate]",60570
How do I create an in-memory handle in Haskell?,60569
How to run executable at end of Setup Project?,60565
Terminal emulation in Flex,60558
C (or any) compilers deterministic performance,60547
Smoothing Zedgraph linegraphs without 'bumps',60542
What are the problems of using transactions in a database?,60518
Where to put master page's code in an MVC application?,60516
C++ function pointers and classes,60507
What's the best way to write JavaScript/Ruby applications on Windows Mobile device?,60484
Self Testing Systems,60478
Getting started with REST [closed],60477
Using the DLR for (primarily) static language compilation,60474
Loading Java classes from a signed applet,60470
Changing the default folder in Emacs,60464
Programmatically get own phone number in Symbian,60461
"DynamicPopulateExtender ,TextArea and line feeds",60456
Take a screenshot of a webpage with JavaScript? [closed],60455
Windows Mobile development in Python,60446
"access $(this) with href=""javascript:..."" in jQuery",60438
What is the benefit of using ONLY OpenID authentication on a site?,60436
IDebugProgramProvider2.GetProviderProcessData on Vista,60422
Do I really need to use transactions in stored procedures? [MSSQL 2005],60419
In PHP is it possible to use a function inside a variable,60409
Calculate code metrics [closed],60394
Alternative to PHP QuickForm?,60369
continuous integration web service [closed],60368
What are the best strategies for using multiple AJAX libraries?,60360
Can distutils create empty __init__.py files?,60352
C++ Quiz - Singletons,60331
What function does a tag cloud serve? [closed],60330
Starting a process with inherited stdin/stdout/stderr in Java 6,60302
Listview background drawing problem C# Winform,60293
Can I change the appearance of an html image during hover without a second image?,60290
If possible how can one embed PostgreSQL?,60285
"Git commit opens blank text file, for what?",60278
What are some good rigid body dynamics references?,60274
Best way to write a Safari 4 Extension [closed],60271
How to implement draggable tab using Java Swing?,60269
My first Lisp macro; is it leaky?,60260
How to load an xml string in the code behind to databound UI controls that bind to the XPath of the XML?,60259
How do you balance fun feature creep with time constraints? [closed],60256
Is there replacement for cat on Windows [closed],60244
How to animate the command line?,60221
