Question,ID
How do I store the window size between sessions in Qt?,74690
Tools to effectively manage the information?,74689
How do I check CPU and Memory Usage in Java?,74674
Has anyone hooked up BizTalk and Fogbugz?,74662
what is the flex (ActionScript3) syntax for a function valued function's type?,74649
Modify an xml files in a jar file with Java,74641
How do you force a CIFS connection to unmount,74626
Date.getTime() not including time?,74620
How To Detect If Type is Another Generic Type,74616
Delphi Out of resources,74614
How do I make an HTML table the same width as its containing div tag?,74612
How to make clipboard ring appear in VS2008 toolbox?,74604
Installing just Quicktime libraries on Windows,74586
CSS : Bad Gray Line to the side of the Navigation Bar on my Website,74570
How to write static code analyzer for .net,74561
VisualSVN Server wants a username and password,74560
TFS annotate/blame summary report for a project,74526
I'm looking to use Visual Studio to write and compile using the open source version of Qt4,74521
Using 7-Zip from Delphi?,74519
"What is the ""best"" canonical implementation of Equals() for reference types?",74514
Limit dev environment to e-mail only certain domains for testing (XP smtp IIS),74494
Why should I care about compacting an MS Access .mdb file?,74484
How to create a scalable Moebius-strip in WPF?,74479
Redundant Call to Object.ToString(),74471
How do I use an icon that is a resource in WPF?,74466
Silverlight- DataGrid control - Selection Changed event interfering with sorting,74461
Getting actual file name (with proper casing) on Windows,74451
Is it possible to connect to Mac OS X 10.5 Leopard's built in vnc server at a low color depth from Windows?,74447
Managing authorized_keys on a large number of hosts,74443
Random in python 2.5 not working?,74430
Game Loop and GDI over .NET CF,74422
Interactive world map - suggestions?,74409
"Is it possible to use Jackpot outside of NetBeans, without NetBeans projects?",74392
Proving correctness of multithread algorithms,74391
Using DLR from Unmanaged Code,74386
How to convert DateTime to VarChar,74385
How to overcome an incompatibility between the ksh on Linux vs. that installed on AIX/Solaris/HPUX?,74372
Outlook 07 2 column flexible layout,74368
How can I get LWP to validate SSL server certificates?,74358
How to fix an MFC Painting Glitch?,74350
How should I detect unnecessary #include files in a large C++ project?,74326
What is the best way to handle photo uploads?,74315
what is the difference between invalidateList and invalidateDisplayList?,74269
How to get an Batch file .bat continue onto the next statement if there is an error,74267
Rendering suggested values from an ext Combobox to an element in the DOM,74266
When is it time to change database backends?,74261
Architect Database to Allow App To Use Windows Integrated Auth or FBA,74258
"In JSTL/JSP, given a java.util.Date, how do I find the next day?",74248
Is it possible to base GroupTemplate (.NET) on anything but a fixed record count?,74224
"How do you restart Rails under Mongrel, without stopping and starting Mongrel",74218
