Question,ID
What do the flags in a Maildir message filename mean?,70140
Re-using soft deleted records,70123
DropDownList doesn't postback on SelectedIndexChanged,70109
Is it bad to load many managed DLL's without using any types in them?,70098
How do I programmatically convert mp3 to an itunes-playable aac/m4a file?,70096
Visually customize autocomplete in Wicket,70090
Ruby exception inheritance with dynamically generated classes,70074
When should you use java stored procedures with an Oracle database ... what are the drawbacks? [closed],70072
Is there a cross-language TDD solution?,70053
How to Detect if I'm Compiling Code with a particular Visual Studio version?,70013
Using Lisp in C#,70004
Tabs and spaces in vim,69998
Writing a Firefox plugin for parsing a custom client-side language,69982
Can I implement a web user authentication system in python without POST?,69979
PostgreSQL DbLink Compilation on Solaris 10,69959
Set 4 Space Indent in Emacs in Text Mode,69934
Hidden Markov Models [closed],69930
WPF: Org Chart TreeView Conditional Formatting,69928
Best way for a Swing GUI to communicate with domain logic?,69927
Get the current mouse coordinates,69926
Stored procedures reverse engineering,69923
MS Access - what are the lowest required permissions for the backend file and for the folder containing it,69918
How do you do paged lists in JavaServer Faces?,69917
Why don't self-closing script elements work?,69913
"What is your favourite 3rd party WinForms.Net graphing tool, and why?",69907
Are there any noted differences in appearance rendering of html and xhtml in Google Chrome from other browsers?,69890
how could I intercept linux sys calls?,69859
Factory Pattern. When to use factory methods?,69849
"What is an example of ""this"" assignment in C#?",69843
"What would cause a visitor to return to the top of the previous page, instead of to the point in the page where the link resides?",69837
How do I use Nant/Ant naming patterns?,69835
Which Open Source CMS do you find most reliable and performance-oriented?,69832
Does the DOCTYPE declaration have to be the first tag in an HTML document? [duplicate],69828
How do you use gnuplot's built-in fonts?,69814
How to configure IIS7 to allow zip file uploads using classic asp?,69788
How do you configure the Apache server which ships Mac OS X?,69768
Visual Studio 2005 ERROR: An error occurred generating a bootstrapper: Invalid syntax,69766
What do you use to write and edit stored procedures in Oracle?,69764
How to associate a file extension to the current executable in C#,69761
Any way to programmatically wrap a .NET WebService with a SoapExtension?,69753
Split a list by distinct date,69748
When do hal properties get updated,69744
"How to use ""%f"" to populate a double value into a string with the right precision",69743
C++: how to get fprintf results as a std::string w/o sprintf,69738
Visual Studio 2005 - 'Updating IntelliSense' hang-up,69729
Astoria vs. SQL Server Data Services,69725
"How do I get the most recently updated form item to ""stick"" in Firefox when I copy its container?",69722
How to infer coercions?,69711
Java Collections using wildcard,69702
What is a good regression testing framework for software applications?,69700
