Question,ID
Versioning library like SQLite database library? [closed],47340
ASP.NET MVC Preview 5 routing ambiguity,47338
UserControl rendering: write link to current page?,47329
Top tips for secure web applications [closed],47323
GODI installation issue,47309
What's the best way to pass data into a Flex chart from a Ruby on Rails application?,47297
Are there any good oracle podcasts? [closed],47279
Storing Windows passwords,47262
How do you set up a Python WSGI server under IIS?,47253
Is there a Firefox 3 addon similar to View Source Chart? [closed],47248
How can I generate database tables from C# classes?,47239
What is the .MSPX file extension?,47235
How would you migrate hundreds of MS Access databases to a central service?,47225
"""Cannot change DataType of a column once it has data"" error in Visual Studio 2005 DataSet Designer",47217
Is there a good Fogbugz client for Mac OS X?,47210
Django: Print url of view without hardcoding the url,47207
How many rows should be in the (main) buffer of a virtual Listview control?,47206
"SQL Server, nvarchar(MAX) or ntext, image or varbinary?",47203
Which Version of Python to Use for Maximum Compatibility,47198
"How do I monitor the computer's CPU, memory, and disk usage in Java?",47177
Is there an event that triggers if the number of ListViewItems in a ListView changes? (Windows Forms),47169
"Do you know of any ""best practice"" or ""what works"" vi tutorial for programmers?",47167
How to set the order in subnodes of a tree structure,47163
Customising log4j adapter,47145
Is there a way to ensure entire code block execution in a .NET thread?,47144
Migrating to a GUI without losing business logic written in COBOL,47133
Disallow publishing of debug builds for ClickOnce deployment,47107
Slow SQL Query due to inner and left join?,47104
Best way in asp.net to force https for an entire site?,47089
How do you prevent SQL injection in LAMP applications?,47087
Javascript tree views that support multiple item drag/drop,47078
"""Getting"" the path in Linux",47066
What code would I use to convert a SQL like expression to a regex on the fly?,47052
Sprintf equivalent in Java,47045
Recursive function for an xml file (hierarchial data),47026
"""Phantom"" directories in an SVN repository",47022
What languages support covariance on inherited methods' return types?,47009
Determining the last changelist synced to in Perforce,47007
MySQL UTF/Unicode migration tips,47005
C# .NET + PostgreSQL,47003
Rotate Windows XP Desktop [closed],46987
Javascript and CSS parsing performance,46982
Silverlight DataBinding cross thread issue,46981
How do you convert an aspx or master page file to page and code behind?,46938
Why doesn't inheritance work the way I think it should work?,46933
Reference material for LabVIEW [closed],46930
How can a simple tree algorithm be coded in a functional language?,46924
What's the proper way to minimize to tray a C# WinForms app?,46918
How can I detect if a Flex app loses focus,46915
Is this the proper use of a mutex?,46909
