Question,ID
ICE Faces fileInput file path and file name properties,9361
Programmatically select multiple files in windows explorer,9355
Running Javascript after control's selected value has been set,9341
Quality Control / Log Monitoring,9338
Generate sitemap on the fly,9336
How do you create a static class?,9321
"""Could not find type"" error loading a form in the Windows Forms Designer",9314
C# 3.0 auto-properties — useful or not? [closed],9304
How do you retrieve selected text using Regex in C#?,9303
onClick doesn't fire with only one input when pressing enter,9301
Removing elements with Array.map in JavaScript,9289
Keep Remote Directory Up-to-date,9279
Using Parameters in MS Reporting Services (SQL Server 2008) against an ODBC data source,9275
How to find untracked files in a Perforce tree? (analogue of svn status),9272
How print Flex components in FireFox3?,9256
Interfaces on different logic layers,9240
Offsite backups [closed],9231
ADO.NET Connection Pooling & SQLServer,9228
IL level code debugger,9204
How to obtain good concurrent read performance from disk,9191
Lingering assembly dependency in C# .NET,9173
Opening a file in my application from File Explorer,9161
FogBugz compared to OnTime [closed],9143
Enterprise Library CacheFactory.GetCacheManager Throws Null Ref,9136
Select all columns except one in MySQL?,9122
"Add a bookmark that is only javascript, not a URL",9104
Accessing audio/video metadata with .NET,9091
grep: show lines surrounding each match [closed],9081
YUI drag&drop proxy drag,9072
Is there a way for MS Access to grab the current Active Directory user?,9052
Can I specify a class wide group on a TestNG test case?,9044
Hidden Features of C#? [closed],9033
HTTPS in IIS 5.1,9024
How have Html entities inside asp.net page?,9022
Best method for varchar date validation in Sybase (T-SQL)?,9019
Windows Mobile Device Emulator - how to save config permanently?,9018
Assignment inside Perl ternary conditional operator problems,9009
How do I get dbmail to process items from the queue for SQL Server 2005?,9002
Calling Table-Valued SQL Functions From .NET,8987
Accessing iSight programmatically?,8970
What OSS project should I look at if I need to do Spring friendly WorkFlow?,8968
Using C#/WIA version 2.0 on Vista to Scan,8966
Storing a file in a database as opposed to the file system? [closed],8952
SharePoint WSS 3.0 Integration with Mac OSX (either Safari or Firefox),8950
Accessing MP3 metadata with Python [closed],8948
Generic type checking,8941
VMWare Server Under Linux Secondary NIC connection,8940
ActionScript 3.0 sockets can't reconnect,8939
"Looking for best practice for doing a ""Net Use"" in C#",8919
Can I get Memcached running on a Windows (x64) 64bit environment?,8896
