Question,ID
How do I call a Flex SWF from a remote domain using Flash (AS3)?,14350
Starting off with OpenGL under Cygwin,14344
RGB to monochrome conversion,14330
Using GLUT bitmap fonts,14318
Using OpenGL textures larger than window/display size,14310
What is the best way to handle files for a small office?,14308
How do I make Powershell run a batch file and then stay open?,14300
GL_FRAMEBUFFER_INCOMPLETE_DUPLICATE_ATTACHMENT_EXT errors,14297
Increasing camera capture resolution in OpenCV,14287
Is there a python module for regex matching in zip files,14281
How to load plugins in .NET?,14278
Boost warnings with VC++ 9,14271
Using GLUT with Visual C++ Express Edition,14264
Best way to let users download a file from my website: http or ftp,14263
Flex: does painless programmatic data binding exist?,14247
What's the deal with |Pipe-delimited| variables in connection strings?,14241
System.Data.SqlClient.SqlException: Failed to generate a user instance of SQL Server,14209
Strange C++ errors with code that has min()/max() calls,14165
Enabling OpenGL in wxWidgets,14138
Subversion and web development,14135
How to create a C++ Boost undirected graph and traverse it in depth first search (DFS) order?,14126
How can I test STDIN without blocking in Perl?,14118
How would you go about evaluating a programmer? [closed],14106
Automated testing a game,14087
Preventing Memory Leaks with Attached Behaviours,14061
What's a Good Database ERD Tool for Linux? [closed],14032
Database triggers,14031
"Disabling a ListView in C#, but still showing the current selection",14029
Genetic Programming in C# [closed],14008
How do I access the Ruby AST from C level code?,13981
Best method of Textfile Parsing in C#?,13963
"Python Sound (""Bell"")",13941
How do I run (unit) tests in different folders/projects separately in Visual Studio?,13938
In Cocoa do I need to remove an Object from receiving KVO notifications when deallocating it?,13927
How do I make a custom .net client profile installer?,13893
Getting started with a Picasa Plugin,13881
Parsing search queries in Java,13863
Can you explain closures (as they relate to Python)?,13857
IE7: header above menu,13851
VisualSVN undelete with TortoiseSVN,13848
How do I create an automated build file for VB.Net in NAnt?,13832
Any Windows APIs to get file handles besides createfile and openfile?,13806
Python Regular Expressions to implement string unescaping,13791
Should we support IE6 anymore? [closed],13786
SoapException: Root element is missing occurs when .NET web service called from Flex,13775
Open ID - What happens when you decide you don't like your existing provider?,13768
How can I remove a child node in HTML using JavaScript?,13763
quoting System.DirectoryServices.ResultPropertyCollection,13753
How can I permanently enable line numbers in IntelliJ?,13751
Resharper and TortoiseSVN,13745
