Question,ID
How do I list the symbols in a .so file,34732
SharePoint List Scalability,34728
Trouble using JRun to Host Java Servlets,34726
Can an audio object be embedded in an InfoPath form?,34717
.Net - Detecting the Appearance Setting (Classic or XP?),34712
Google Talk's Graphics Toolkit?,34711
How do you use the new ModelBinder classes in ASP.NET MVC Preview 5,34709
"How can I generate a unique, small, random, and user-friendly key?",34708
Best practices with jQuery form binding code in an application,34705
How to turn off sounds in TortoiseSVN?,34698
"Subversion ignoring ""--password"" and ""--username"" options",34687
Performance difference between dot notation versus method call in Objective-C,34674
"How to keep a ""things done"" count in a recursive algorithm in Java?",34669
DesignMode with nested Controls,34664
Automate test of web service communication,34661
Making an iframe take vertical space,34655
data 'security' with java and hibernate,34638
How do I get the assembler output from a C file in VS2005,34635
Why is HTML form redirection used in OpenID 2?,34623
Toolkit Options for 2D Python Game Programming [closed],34611
What is a good Hash Function?,34595
How do I change the number of open files limit in Linux? [closed],34588
inline-block on span,34581
"MySQL ""Error 1005"" when adding tables",34579
"How do I test a class that has private methods, fields or inner classes?",34571
How do I generate a random 10 digit number in ruby?,34565
Detect DOM modification in Internet Explorer,34544
How do you swap DIVs on mouseover (jQuery)?,34536
What is a mutex?,34524
What is a semaphore?,34519
Natural Sorting algorithm,34518
Is there a standard (like phpdoc or python's docstring) for commenting C# code?,34516
What is a deadlock?,34512
What is a race condition? [closed],34510
Natural (human alpha-numeric) sort in Microsoft SQL 2005,34509
Simulating a virtual static member of a class in c++?,34506
Is Object.GetHashCode() unique to a reference or a value?,34505
Excel: list ranges targeted by INDIRECT formulas,34493
How do I create a SHA1 hash in ruby?,34490
Does limiting a query to one record improve performance,34488
What more is needed for Ajax than this function,34486
What is in your JavaScript development toolbox?,34476
Technical Hurdles for Win32 rsync port,34463
Finding what methods a Python object has,34439
How to Format Numbers in WinForms 1.1 DataGrid?,34428
Why am I getting a NoClassDefFoundError in Java?,34413
How do I generate a friendly URL in Symfony PHP?,34411
Send email from Elmah?,34401
How to dispay unordered list inline with bullets?,34399
How should I model a field that can contain both numeric and string values in SQL Server 2005?,34398
