Question,ID
HTML Select Tag with black background - dropdown triangle is invisible in Firefox 3,29244
How do I create an xml document in python,29243
Off-the-Shelf C++ Hex Dump Code [closed],29242
DoDragDrop and MouseUp,29177
(IIS/Win2000Pro) Granting Registry read rights to IIS user?,29175
SimpleModal breaks ASP.Net Postbacks,29174
Deploying a Git subdirectory in Capistrano,29168
How do I make a PictureBox use Nearest Neighbor resampling?,29157
What are the differences between delegates and events?,29155
Generating database tables from object definitions,29145
What is the more efficient version control methodology: checkout or merge?,29144
Getting ssh to execute a command in the background on target machine,29142
"Using Interop with C#, Excel Save changing original. How to negate this?",29141
Generic IBindingListView Implementations,29107
Requirements Gathering,29104
How are you generating tests from specifications?,29100
What makes a language Object-Oriented?,29099
What is the difference between a group and match in .NET's RegEx?,29088
Creating a UserControl Programmatically within a repeater?,29067
How do you use ssh in a shell script?,29061
Javascript Browser Quirks - array.Length,29053
Good Free Alternative To MS Access [closed],29044
Linq To SQL: Can I eager load only one field in a joined table?,29040
SharePoint SPContext.List in a custom application page,29030
Is there a way to combine named scopes into a new named scope?,29011
Parsing XML using unix terminal,29004
Simple explanation of MapReduce?,28982
Anyone using CouchDB? [closed],28975
Checklist for Web Site Programming Vulnerabilities,28965
What's the best way to use web services in python?,28961
CPU utilization by database?,28952
Guide to choosing between REST vs SOAP services?,28950
Why do you not explicitly call finalize() or start the garbage collector?,28949
Expanding Virtual Disk [closed],28946
Best architecture for handling file system changes?,28941
Best JavaScript compressor [closed],28932
SQLServer Get Results Where Value Is Null,28922
Datatypes for physics,28896
.NET Compiler -- DEBUG vs. RELEASE,28894
Why doesn't **sort** sort the same on every machine?,28881
Determine Parent Node Of DOMElement,28878
Why does SQL Server work faster when you index a table after filling it?,28877
Coolest C# LINQ/Lambdas trick you've ever pulled? [closed],28858
Can SlickEdit automatically update its tag files?,28843
Scrum - How to get better input from the functional/commercial team [closed],28840
What causes Visual Studio to fail to load an assembly incorrectly?,28839
Java and manually executing finalize,28832
What exactly is Microsoft Expression Studio and how does it integrate with Visual Studio?,28826
XML => HTML with Hpricot and Rails,28823
Windows Mobile - What scripting platforms are available?,28820
