Question,ID
MS Team Foundation Server in distributed environments - hints tips tricks needed,10999
What are the proper permissions for an upload folder with PHP/Apache?,10990
How to prevent an object being created on the heap?,10985
IKVM and Licensing,10980
Unit tests for deep cloning,10949
How to trace COM objects exceptions?,10935
Can you recommend a good .NET web-based repository browser for SVN? [closed],10933
Deleting / Replacing A Node in E4X (AS3 - Flex),10926
How do you measure SQL Fill Factor value,10919
Best way to model Many-To-One Relationships in NHibernate When Dealing With a Legacy DB?,10915
Can you use generic forms in C#?,10905
"Future proofing a large UI Application - MFC with 2008 Feature pack, or C# and Winforms?",10901
How to set up a DB2 linked server on a 64-bit SQL Server 2005?,10898
Best way to connect To Sql Server with MFC,10891
Any good advice on using emacs for C++ project? [closed],10880
How can you customize the numbers in an ordered list?,10877
How to encourage someone to learn programming? [closed],10872
"How can I ""unaccept"" a drag in Flex?",10870
Data Layer Best Practices,10860
LINQ query on a DataTable,10855
How to programmatically send SMS on the iPhone?,10848
Compare a date string to datetime in SQL Server?,10825
How to quickly test database access via a connection string,10822
"SQL, Auxiliary table of numbers",10819
"Why do I get the error ""Unable to update the password"" when calling AzMan?",10810
Ruby mixins and calling super methods,10808
Catching unhandled exceptions in ASP.NET UserControls,10793
Convert an asp.net application to IIS7 integrated mode,10782
What is the difference between integration and unit tests?,10752
Best way to store a database password in a startup script / config file?,10731
"What is a ""reasonable"" length of time to keep a SQL cursor open?",10727
Is there a difference between the on_exit() and atexit() functions?,10680
Asynchronous Remoting calls,10670
Reading Other Process' Memory in OS X?,10668
Does the OutputCacheFilter in the Microsoft MVC Preview 4 actually save on action invocations?,10661
Creating iCal Files in c#,10658
Any decent C# profilers out there? [closed],10644
Why are my PowerShell scripts not running?,10635
Should I switch from nant to msbuild?,10634
Differences between MySQL and SQL Server [closed],10616
Pre-built regular expression patterns or Regex Libraries? [closed],10610
Automatically measure all SQL queries,10604
Web page field validation,10599
"How do I write those cool command line code generators (rails, sproutcore, webgen)",10595
Small modification to an XML document using StAX,10586
What is the difference between Early and Late Binding?,10580
How can I set up an editor to work with Git on Windows?,10564
Parsing attributes with regex in Perl,10533
What's the preferred way to connect to a postgresql database from PHP?,10532
Using C# with OpenOffice through reflection,10531
