Question,ID
How can I create Prototype Methods (like JavaScript) in C#.Net?,4610
Video Compression: What is discrete cosine transform?,4582
How to setup Quality of Service?,4565
DataTable Loop Performance Comparison,4556
What was the <XMP> tag used for?,4545
Http Auth in a Firefox 3 bookmarklet,4544
Simple MOLAP solution,4541
HTTP: Generating ETag Header,4533
SQL Server 2005 and 2008 on same developer machine?,4529
Using Xming X Window Server over a VPN,4519
Is there any trick that allows to use Management Studio's (ver. 2008) IntelliSense feature with earlier versions of SQL Server?,4511
MAPI and managed code experiences? [closed],4508
How to know when to send a 304 Not Modified response,4506
Domain Specific Language resources [closed],4458
Can I configure Visual Studio NOT to change StartUp Project every time I open a file from one of the projects?,4434
CSV string handling,4432
How to easily consume a web service from PHP,4430
How do I update Ruby Gems from behind a Proxy (ISA-NTLM),4418
"Where can I get the Windows Workflow ""wca.exe"" application?",4416
Drop all tables whose names begin with a certain string,4393
How do I retrieve my MySQL username and password?,4371
How to include PHP files that require an absolute path?,4369
What is the best way to do unit testing for ASP.NET 2.0 web pages? [closed],4363
Where is a good place to start programming GUIs for windows? [closed],4347
High availability,4335
ASP.Net 2.0 Application without Business Logic Layer?,4320
What is Object Mocking and when do I need it?,4314
What is the best way to create a sparse array in C++?,4306
Grid Hosting for Windows,4305
Why should I practice Test Driven Development and how should I start? [closed],4303
How Do You Determine The PID of the Parent of a Process,4287
Programmatic SMS [closed],4269
What is best practice for FTP from a SQL Server 2005 stored procedure?,4246
Why doesn't Java autoboxing extend to method invocations of methods of the autoboxed types?,4242
What to use for Messaging with C# [closed],4234
The Difference Between a DataGrid and a GridView in ASP.NET?,4230
Accessing a Dictionary.Keys Key through a numeric index,4227
Territory Map Generation,4225
LinqDataSource - Can you limit the amount of records returned?,4221
SVN vs. Team Foundation Server [closed],4219
Windows Equivalent of 'nice',4208
How to learn ADO.NET,4170
Graph serialization,4168
What is a good barebones CMS or framework? [closed],4164
ConfigurationManager.AppSettings Performance Concerns,4157
Best way to cache data,4151
How do I use Java to read from a file that is actively being written to?,4149
SVN Client Ignore Pattern for VB.NET Solutions,4138
What program can I use to generate diagrams of SQL view/table structure? [closed],4110
What code analysis tools do you use for your Java projects? [closed],4080
