Question,ID
"Can't create a subversion repository with Eclipse 3.4.0, svn 1.5.1",33990
Find out how much memory is being used by an object in Python [duplicate],33978
Microsoft Office 2007 automated installation - editing the config.xml file,33976
How do I efficiently keep track of the smallest element in a collection?,33973
Standardised text editing behaviour across Mac applications,33971
Best way to implement request throttling in ASP.NET MVC?,33969
How do you get the ethernet address using Java?,33960
How to get facet ranges in solr results?,33956
NHibernate SetTimeout on ICriteria,33955
Convert Web.config from .NET 2.0 to 3.5,33949
How to handle variable width FieldObjects in Crystal Reports,33937
100% width textarea ignores parent element's width in IE7,33933
What is tail recursion?,33923
Ribbon Toolbar and Visual Studio 2008 Service Pack 1,33909
Formatting Stored Procedures [closed],33903
Best iCalendar library for Java? [closed],33901
Determining width of a printed string by a webapp,33893
Font rendering for web pages,33881
Is it possible to call Javascript's onsubmit event programmatically on a form?,33860
.net multilingual cms,33853
Using Unsigned Primitive Types,33852
How to avoid pauses when editing code on a network drive?,33843
IE CSS Bug - How do I maintain a position:absolute when dynamic javascript content on the page changes,33837
How can I find the revision history of the file that was deleted and then resubmitted to SVN?,33836
How do I detect if a function is available during JNLP execution?,33829
Any way to write a Windows .bat file to kill processes? [closed],33822
How to determine if an html tag splits across multiple lines,33814
What are some useful TextMate features? [closed],33813
How can I use `scp` to deploy a website's `.htaccess` file?,33790
Windows 2003 Scheduled Task Cmdlet (v 1.0),33779
How do I delete 1 file from a revision in SVN?,33778
Any advice for speeding up the compile time in Flex Builder 3?,33768
How can I retrieve a list of parameters from a stored procedure in SQL Server,33761
How do I add a MIME type to .htaccess?,33751
XML attribute vs XML element [closed],33746
WordPress MediaWiki integration,33745
JSP debugging in IntelliJ IDEA,33739
How should I build a good (web) API,33728
CLR Profiler - Attaching to existing process,33727
Change templates in Xcode,33720
"My (Java/Swing) MouseListener isn't listening, help me figure out why",33708
How can you make a .net windows forms project look fresh?,33703
Cocoa tips for PHP developers?,33696
SQL 2000 'TRY CATCH like' Error Handling,33685
Best Practices for Managing Linq to SQL Dbml Files?,33664
Testing and Managing database versions against code versions,33638
How does GPS in a mobile phone work exactly? [closed],33637
What's the maximum amount of RAM I can use in a Windows box?,33630
Concurrent logins in a web farm,33619
CreateProcessAsUser vs ShellExecute,33594
