Question,ID
Why doesn't my favicon display for my web site?,6732
Icons: How does a developer with no design skill make his/her application icons look pretty? [closed],6729
Master Pages for large web sites,6719
When is OOP better suited for? [closed],6703
"ASP.NET Web Service Results, Proxy Classes and Type Conversion",6681
"Web Services -- WCF vs. ASMX (""Standard"")",6666
JUnit vs TestNG [closed],6658
Preferred way to use favicons?,6642
How should I load files into my Java application?,6639
Making code work with register_globals turned off,6633
"PHP array indexing: $array[$index] vs $array[""$index""] vs $array[""{$index}""]",6628
sgen.exe fails during build,6623
What rule engine should I use? [closed],6613
Are there any decent free Java data plotting libraries out there? [closed],6612
Registry vs. INI file for storing user configurable application settings [closed],6607
PHP4 to PHP5 Migration [closed],6594
Which Agile software development methods have you had the most success with? [closed],6579
Understanding reference counting with Cocoa and Objective-C,6578
"In C#, why can't a List<string> object be stored in a List<object> variable",6557
Two marbles and a 100 story building,6547
Where should I put my log file for an asp.net application?,6530
How to implement continuations?,6512
"What style do you use for creating a ""class""?",6499
How do you mock a Sealed class?,6484
Faster way to find duplicates conditioned by time,6475
Date arithmetic in Unix shell scripts,6467
How can I enable disabled radio buttons?,6441
.NET 3.5 Redistributable -- 200 MB? Other options?,6440
How to programmatically iterate datagrid rows?,6430
C# loop — break vs. continue,6414
How to access .Net element on Master page from a Content page?,6406
Java Time Zone is messed up,6392
What client(s) should be targeted in implementing an ICalendar export for events?,6378
What's the difference in closure style,6373
"How do you manage databases in development, test, and production?",6371
How to pass a comma separated list to a stored procedure?,6369
Multiple foreign keys?,6340
Haml: how do I set a dynamic class value?,6326
Why are unsigned int's not CLS compliant?,6325
"Why is Array.Length an int, and not an uint [duplicate]",6301
VS 2008 - Objects disappearing?,6284
Eclipse on win64,6222
E-mail Notifications,6210
Split a string ignoring quoted sections,6209
FF3 WinXP != FF3 Ubuntu - why?,6208
Experiences of the Smart Client Software Factory,6207
How do I make event callbacks into my win forms thread safe?,6184
Regular expression for parsing links from a webpage?,6173
Common Types of Subversion Hooks [closed],6155
How do I edit work items in the Visual Studio 2008 xml editor?,6151
