Question,ID
Accessing Sharepoint from outside the WebUI,33174
How do I keep my Login.aspx page's ReturnUrl parameter from overriding my ASP.NET Login control's DestinationPageUrl property?,33166
How to pass method name to custom server control in asp.net?,33150
"Windows Mobile 6 Development, alternatives to visual studio?",33144
Building a custom Linux Live CD [closed],33117
Does C# have the notion of private and protected inheritance?,33115
Is there any way to override the drag/drop or copy/paste behavior of an existing app in Windows?,33113
Communicating between websites (using Javascript or ?),33104
How Do Sites Suppress Pasting Text?,33103
How do I use ASP.NET Login Controls when my Login.aspx is not at the root of my application?,33089
ensuring uploaded files are safe,33086
Setting the height of a DIV dynamically,33080
Pattern recognition algorithms,33076
Ignore Emacs auto-generated files in a diff,33073
Looking for Regex to find quoted newlines in a big string (for C#),33063
Best way to export a QTMovie with a fade-in and fade-out in the audio,33061
SVN repository backup strategies,33055
How would you test observers with rSpec in a Ruby on Rails application?,33048
How can I measure CppUnit test coverage (on win32 and Unix)?,33042
"How do banks remember ""your computer""?",33034
Leaving your harddrive shared,32991
NSEnumerator performance vs for loop in Cocoa,32986
How to program user preferences,32966
SQL Server 2008 Reporting Services Control,32941
Shorthand conditional in C# similar to SQL 'in' keyword,32937
What is a good dvd burning component for Windows or .Net?,32930
Is there a way to render svg data in a swf at runtime?,32914
How do you generate dynamic (parameterized) unit tests in Python?,32899
Do Java multi-line comments account for strings?,32897
"How to remove ""VsDebuggerCausalityData"" data from SOAP message?",32877
Browsers' default CSS stylesheets,32875
How can I resize a swf during runtime to have the browser create html scrollbars?,32871
"Multicasting, Messaging, ActiveMQ vs. MSMQ?",32851
Creating System Restore Points - Thoughts?,32845
XNA Unit Testing,32835
Why does HttpCacheability.Private suppress ETags?,32824
ASP.NET Validators inside an UpdatePanel,32814
Email Delivery Question,32803
Alternatives to System.exit(1),32790
Restrict the server access from LAN only,32780
What is the best and most complete implementation of Unix system commands for Windows?,32777
generation of designer file failed,32766
How can I take a byte array of a TIFF image and turn it into a System.Drawing.Image object?,32750
How do I get today's date in C# in mm/dd/yyyy format?,32747
"What protocols and servers are involved in sending an email, and what are the steps?",32744
.NET : Double-click event in TabControl,32733
Setting time zone remotely in C#,32718
Out-of-place builds with C#,32717
Is there a way to get images to display with ASP.NET and app_offline.htm?,32715
"Isn't Func<T, bool> and Predicate<T> the same thing after compilation?",32709
