Question,ID
Visual Studio Setup Project - Per User Registry Settings,810
"ASP, need to use SFTP",805
How do I use itertools.groupby()?,773
Solving a linear equation,769
Python and MySQL,766
Localising date format descriptors,761
How to create a new object instance from a Type,752
Format string to title case,746
Class views in Django,742
Why doesn't VFP .NET OLEdb provider work in 64 bit Windows?,717
.NET testing framework advice,709
Embedded Database for .net that can run off a network [closed],705
Connect PHP to IBM i (AS/400),696
Using 'in' to match an attribute of Python objects in an array,683
Encrypting Passwords,657
Checklist for IIS 6/ASP.NET Windows Authentication?,651
Automatically update version number,650
Swap unique indexed column values in database,644
"When to use lambda, when to use Proc.new?",626
Most efficient code for the first 10000 prime numbers?,622
Build for Windows NT 4.0 using Visual Studio 2005?,609
Robust Random Number Generation [closed],601
cx_Oracle: How do I iterate over a result set?,594
Best way to access Exchange using PHP? [closed],588
Deploying SQL Server Databases from Test to Live,580
What is the difference between an int and an Integer in Java and C#?,564
How to write to Web.Config in Medium Trust?,562
How to use combinations of sets as test data,561
The definitive guide to form-based website authentication [closed],549
Continuous Integration System for a Python Codebase [closed],535
Frequent SystemExit in Ruby when making HTTP calls,514
Get a preview JPEG of a PDF on Windows?,502
WinForms ComboBox data binding gotcha,482
Homegrown consumption of web services [closed],470
How can I find the full path to a font from its display name on a Mac?,469
"Implementation of ""Remember me"" in a Rails application",438
Programmatically launch IE Mobile favorites screen,427
Unload a COM control when working in VB6 IDE,419
"iPhone app in landscape mode, 2008 systems",402
Lucene Score results,387
What is the meaning of the type safety warning in certain Java generics casts?,382
How do you make sure email you send programmatically is not automatically marked as spam?,371
Generate list of all possible permutations of a string,361
XML Processing in Python,337
When to use unsigned values over signed ones?,336
Should I use nested classes in this case?,330
PHP Session Security,328
Is there a version control system for database structure changes?,308
How do you sort a dictionary by value?,289
"Best Practice: Collaborative Environment, Bin Directory, SVN [closed]",265
