Question,ID
How do I lock a file in Perl?,34920
Scaffolding in pylons,34916
How do you use XML::Parser with Style => 'Objects',34914
C# Linq Grouping,34913
When is it best to sanitize user input?,34896
Print out the keys and Data of a Hashtable in C# .NET 1.1,34879
How do you create optional arguments in php?,34868
How to benchmark a SQL Server Query?,34858
NHibernate Session.Flush() Sending Update Queries When No Update Has Occurred,34852
"Zend Framework: setting a Zend_Form_Element form field to be required, how do I change the validator used to ensure that the element is not blank",34848
SQL Server - Does column order matter?,34818
What is the best way to tell if an object is modified?,34809
Class design decision,34806
ValidationRule To Enforce Unique Name,34802
Entire Page refreshes even though gridview is in an update panel,34798
duplicating jQuery datepicker,34790
Mercurial .hgignore for Visual Studio 2008 projects,34784
How do you build a ratings implementation?,34781
Setting a form's action in .net 3.5 SP1 causes errors when compiled,34768
Using a rotary encoder with AVR Micro controller,34735
Best Way to Reuse Code When Using Visual Studio?,34734
How do I list the symbols in a .so file,34732
SharePoint List Scalability,34728
Trouble using JRun to Host Java Servlets,34726
Can an audio object be embedded in an InfoPath form?,34717
.Net - Detecting the Appearance Setting (Classic or XP?),34712
Google Talk's Graphics Toolkit?,34711
How do you use the new ModelBinder classes in ASP.NET MVC Preview 5,34709
"How can I generate a unique, small, random, and user-friendly key?",34708
Best practices with jQuery form binding code in an application,34705
How to turn off sounds in TortoiseSVN?,34698
"Subversion ignoring ""--password"" and ""--username"" options",34687
Performance difference between dot notation versus method call in Objective-C,34674
"How to keep a ""things done"" count in a recursive algorithm in Java?",34669
DesignMode with nested Controls,34664
Automate test of web service communication,34661
Making an iframe take vertical space,34655
data 'security' with java and hibernate,34638
How do I get the assembler output from a C file in VS2005,34635
Why is HTML form redirection used in OpenID 2?,34623
Toolkit Options for 2D Python Game Programming [closed],34611
What is a good Hash Function?,34595
How do I change the number of open files limit in Linux? [closed],34588
inline-block on span,34581
"MySQL ""Error 1005"" when adding tables",34579
"How do I test a class that has private methods, fields or inner classes?",34571
How do I generate a random 10 digit number in ruby?,34565
Detect DOM modification in Internet Explorer,34544
How do you swap DIVs on mouseover (jQuery)?,34536
What is a mutex?,34524
