Question,ID
PHP and Java EE Backend,38948
Generate field in MySQL SELECT,38940
How to take screenshot in Mac OS X using Cocoa or C++,38934
Running DB Migrations from application,38922
"php mail() not working windows 2003, IIS SMTP",38920
"Developing on Eclipse 3.4, running on Eclipse 3.3",38907
Strange Rails Authentication Issue,38901
Enforce constraint checking only when inserting rows in MSSQL?,38890
Best way to avoid code injection in PHP,38875
One or Two Primary Keys in Many-to-Many Table?,38870
How do you find out which NIC is connected to the internet?,38864
Will this hardware be 64bit Windows Server 2008 compatible?,38861
How to encrypt one message for multiple recipients?,38846
How to do a simple mail merge in OpenOffice,38842
Two-way password encryption without ssl,38838
Is Wiki Content Portable?,38824
"Best full text search alternative to MS SQL, C++ solution",38822
Which class design is better? [closed],38820
SQL - How to store and navigate hierarchies?,38801
Which database table Schema is more efficient?,38791
Web Service Namespace Dynamic Naming,38789
Visual Studio equivalent to Delphi bookmarks,38784
What SPN do I need to set for a net.tcp service?,38779
How would you extract data from a MS Project .mpp file? [closed],38769
How do I use a different database connection for package configuration?,38766
What design pattern is PEAR DB_DataObject implementing?,38763
Concurrent collections in C#,38756
How to detect file ends in newline?,38746
Do you know how to implement transactions in Castle ActiveRecord?,38729
WebClient.DownloadFileAsync fails to raise exception,38726
What is the best way to create a wizard in C# 2.0?,38719
ruby idioms for using command-line options,38713
How to grab the contents of HTML tags?,38691
How to provide next page of updated content?,38680
Does Adobe Flash support databases?,38674
ASP.NET controls cannot be referenced in code-behind in Visual Studio 2008,38670
Does the PHP mail() function work if I don't own the MX record,38669
Can you modify text files when committing to subversion?,38664
Can IIS 6 serve requests for pages with no extensions?,38661
Automatically floating all fields in a VFP report?,38654
Any way to have an ActionScript 3 (Flex/AIR) project print to standard output?,38651
Performance of Linq to Entities vs ESQL,38647
What are some efficient ways to combine two structures in MATLAB?,38645
What static analysis tools are available for C#? [closed],38635
ASP.NET XML ObjectDataSource Wrapper Class Examples,38629
LSP in OO programming?,38618
asp:DropDownList Error: 'DropDownList1' has a SelectedValue which is invalid because it does not exist in the list of items,38612
Best way to display/format SQL 2005 money data type in ASP.Net,38602
Using Django time/date widgets in custom form,38601
How do you unit test business applications?,38598
