Question,ID
Asp.Net MVC: How to determine if you're currently on a specific view,40535
Why should I use Feature Driven Development? [closed],40531
Call Functions within Function - Flash Actionscript 2.0,40525
Return function pointer to a nested function in C,40511
Bug tracker setup with Git integration? [closed],40495
Optimizing Conway's 'Game of Life',40485
"Is Java ""pass-by-reference"" or ""pass-by-value""?",40480
What are the differences between a HashMap and a Hashtable in Java?,40471
How to get an array of distinct property values from in memory lists?,40465
"sql missing rows when grouped by DAY, MONTH, YEAR",40456
HTTP POST  - I'm stuck,40452
How would you implement Erlang-like send and receive in C++?,40423
"Autocomplete Dropdown with Linkbuttons - or ""AJAX gone wild""",40422
How to traverse a maze programmatically when you've hit a dead end,40413
What is the command to truncate a SQL Server log file?,40402
Handle signals in the Java Virtual Machine,40376
How can you export the saved username and passwords in FireFox 2?,40372
Maximum number of inodes in a directory? [closed],40368
Can I create a value for a missing tag in XPath?,40361
Whats the difference between RuntimeTypeHandle and Type?,40352
Coding magazines [closed],40346
What's the best way to work with SQL Server data non-programmatically?,40344
How to tell which disk Windows Used to Boot,40335
"I can't see ""Report Builder"" button in the Report Manager on SQL Server 2005",40322
Force unmount of NFS-mounted directory [closed],40317
"Installer changes PATH variable, changes don't show up in Command Shell",40311
Create object from database row,40302
"Redirecting "".local"" subdomain to unicast DNS",40295
What's the best way to use SOAP with Ruby?,40273
Finding the storage card path on WM6,40269
How many constructor arguments is too many? [closed],40264
GUI/TUI linux library,40259
How to make a pipe loop in bash,40244
What is the best way to migrate an existing messy webapp to elegant MVC? [closed],40242
GUIDs as Primary Keys - Offline OLTP,40230
How to Compare Flags in C#?,40211
Quick ls command,40193
How to compress JPEG images with ASP on Windows CE,40171
Is it okay to have a lot of database views?,40169
Does C# have built-in support for parsing page-number strings?,40161
How do you beta test an iphone app?,40154
Why do jQuery selectors sometimes not work in Internet Explorer,40151
Getting Apache to modify static webpages on the fly,40133
Best way to pass a large number of arguments into a configuration dialog,40132
Reading from a http-get presenting in Firefox bookmarks,40125
Exceptions in Web Services,40122
How to find a Java Memory Leak,40119
How do I install and use the ASP.NET AJAX Control Toolkit in my .NET 3.5 web applications?,40116
Is there a way to get ms-access to display images from external files,40112
Using attributes to cut down on enum to enum mapping and enum/const to action switch statments,40107
