Question,ID
How to get the identity of an inserted row?,42648
Scripting the Visual Studio IDE,42643
Best practices for portable C# [closed],42627
"SQL Server Views, blessing or curse? [closed]",42620
Metalanaguage to describe the Model from MVC to generate identical client and server side code,42610
Double dispatch in C#?,42587
What View Engine are you using with ASP.NET MVC? [closed],42582
Python re.sub with a flag does not replace all occurrences,42581
Troubleshoot Java Lucene ignoring Field,42575
Getting the Hostname or IP in Ruby on Rails,42566
Python and the Singleton Pattern [duplicate],42558
Best way to incorporate spell checkers with a build process,42557
Can't get my event to fire,42554
Extract Address Information from a Web Page,42550
How can I draw a curve that varies in thickness along its path?,42546
How do I call ::CreateProcess in c++ to launch a Windows executable?,42531
How do you rotate a two dimensional array?,42519
Dealing with Latency in Networked Games,42515
Deleting a Google App Engine application,42512
Thread-safe use of a singleton's members,42505
asp:UpdateProgress - suppressing the line-break,42499
TFS - Branching for experimental development: Solution fails to load,42490
"How to implement a ""related"" degree measure algorithm? [closed]",42489
Simulated OLAP,42483
Best way to extract text from a Word doc without using COM/automation? [closed],42482
How do I measure bytes in/out of an IP port used for .NET remoting?,42468
MSDN subscriptions on the cheap? [closed],42466
Custom titlebars/chrome in a WinForms app,42460
Is BCEL == monkeypatching for java?,42452
How do I convert an IntPtr to a Stream?,42446
What's the best way to detect the presence of SMO?,42438
"Best way to handle input from a keyboard ""wedge""",42437
Window managers for Windows and Macs [closed],42428
Is reusing a variable in VB6 a good idea?,42422
How can I install libgluezilla on Ubuntu 8.04?,42416
How do I implement OpenID in my web application?,42407
ASP.Net: why is my button's click/command events not binding/firing in a repeater?,42396
How do I write a While loop [closed],42395
What is the C# equivalent of the Oracle PL/SQL COALESCE function?,42386
Java object allocation overhead,42383
What does the EXE do in the Visual Studio setup project output,42366
How do you check your URL for SQL Injection Attacks?,42357
How to evaluate an IP?,42345
IE6 rending UL's incorrectly,42342
How to display a live streaming video using VideoDisplay in Flex,42333
Real image width with JavaScript,42323
Are There Adapters for CF Type II to MicroSD?,42312
Tool to track #include dependencies [closed],42308
How do you get the footer to stay at the bottom of a Web page?,42294
What's the best way to read the contents of a text file to a string in .NET?,42286
