Question,ID
What's the best way to return multiple values from a function? [duplicate],38508
What's a good algorithm to generate a maze? [closed],38502
Thread pool for executing arbitrary tasks with different priorities,38501
Is SOAP now a legacy technology?,38463
Asynchronous Mysql connector,38447
How to track data changes in a database table,38437
Retrieving an Oracle timestamp using Python's Win32 ODBC module,38435
ASP.NET MVC - How do action names affect the url?,38431
Positioning controls in the middle of a CheckBox,38428
Tips for working in a large library? [closed],38427
Security advice for jquery ajax data post?,38421
How do I convert a Ruby string with brackets to an array?,38409
"How can I make flash cs3, actionscript send events to javascript?",38408
Clone a control in silverlight,38378
PHP : session variable aren't usable when site is redirected,38370
Best version control system for managing home directories,38362
Error Code Reference for OSX/Cocoa,38357
Address book DB schema,38352
Finding all messages with a given PR_SEARCH_KEY,38348
Is there an elegant zip to interleave two lists in Perl 5?,38345
"On the web, what fonts should I use to create an equivalent experience cross-platform? [closed]",38336
VMware or Hyper-V for Developers [closed],38323
Is there any way to draw an image to use 4 points rather than 3 (perspective warp),38308
How do I strip the fluff out of a third party library?,38305
Pinning pointer arrays in memory,38302
Tutorial on understanding strings in Symbian [closed],38299
Apply an ICC Color Profile to an image in C# (Dotnet),38295
How do I add a user in Ubuntu? [closed],38288
Best browser for web application [closed],38280
Practices for programming in a scientific environment? [closed],38239
What is the purpose of class methods?,38238
IronRuby performance?,38235
Why does this C code produce a double instead of a float?,38198
Why is the subprocess.Popen class not named Subprocess? [closed],38197
Determine if a ruby script is already running,38193
How do I read a disk directly with .NET?,38190
Any data-driven open source JEE5 EJB3+JSF Sample Project out there? [closed],38183
When should I mock?,38181
Parallelize Bash script with maximum number of processes,38160
What is a good maintainability index using Visual Studio 2008 code analysis?,38158
<asp:hyperlink> after opening target in new window - new window cannot be closed,38151
Strategies for keeping a Lucene Index up to date with domain model changes,38125
Inbox Management (in Outlook),38117
Cross Page Postback doesn't work for client-side enabled button,38107
How to prevent Write Ahead Logging on just one table in PostgreSQL?,38090
How to implement mouse dragging in Visual Basic?,38081
Best way to handle LOBs in Oracle distributed databases,38074
Generics in Java,38068
Why @OneToMany does not work with inheritance in Hibernate,38057
How to check if a process is still running using Python on Linux? [duplicate],38056
