Question,ID
What is the replacement of Controller.ReadFromRequest in ASP.NET MVC?,36064
"How do I close a popup window, and open the next page in the main window in ROR?",36058
What's a good open source VoiceXML implementation?,36056
Anyone have experience with Sphinx speech recognition?,36054
Templates spread across multiple files,36039
Yaws uses old config file,36030
How to assign a method's output to a textbox value without code behind,36028
Deleting messages from Exchange IMAP mailbox on iPhone,36019
Why is .NET exception not caught by try/catch block?,36014
SQL Server 2005 Auto Updated DateTime Column - LastUpdated,36001
How do I execute a file in Cygwin?,35999
Altering database tables in Django,35991
C-like structures in Python,35988
Rolling back bad changes with svn in Eclipse,35983
Embed Images in emails created using SQL Server Database Mail,35974
Add predefined data for typedef enums in C,35973
How do you full-text search multiple criteria on left-joined tables in SQL Server?,35954
I don't understand std::tr1::unordered_map,35950
Django templates and variable attributes,35948
Logging in a PHP webapp [closed],35943
Launch a file with command line arguments without knowing location of exe?,35914
3rd Party UI components for .net Compact Framework? [closed],35907
How do I autorun an application in a terminal in Ubuntu?,35905
How can I play compressed sound files in C# in a portable way?,35896
Grid controls compatible with .NET and Mono?,35893
Base64 Encoding Image,35879
"Comparison of Lat, Long Coordinates",35870
P/Invoke in Mono,35853
What logging is good logging for your app? [closed],35849
VB.NET form Height Question,35848
How can a Java program get its own process ID?,35842
What is the Difference Between Mercurial and Git?,35837
"Get a list of current windows, and give one of them focus, in .Net",35834
How to escape os.system() calls?,35817
Why is my instance variable not in __dict__?,35805
Techniques to detect Polymorphic and Metamorphic viruses? [closed],35798
XML serialization in Java? [closed],35785
Formatting tabular data using unicode characters,35782
How to embed user-specific data in .NET windows setup app at setup download time?,35772
Linux GUI development [closed],35762
Is Python good for big software projects (not web based)? [closed],35753
Is it possible to list named events in Windows?,35748
Are there any tools to visualize template/class methods and their usage?,35745
FileUpload control inside an UpdatePanel without refreshing the whole page?,35743
"Desktop search utility for pdf,chm and djvu files [closed]",35722
Seeking code highlighter recommendation for WordPress [closed],35721
How do I change my Active Sound Card on the Fly?,35709
Decision making in distributed applications,35707
Writing cross-platform apps in C,35700
"On a two-column page, how can I grow the left div to the same height of the right div using CSS or Javascript?",35699
