Question,ID
Standard Signature a Text in a Message using Exchange Server,11275
ASP.NET UserControl's and DefaultEvent,11267
Do you know any patterns for GUI programming? (Not patterns on designing GUIs),11263
Calling REST web services from a classic asp page,11219
T-Sql date format for seconds since last epoch / formatting for sqlite input,11200
.NET Framework dependency,11199
How can I conditionally apply a Linq operator?,11194
How do I create a workflow instance reliably based on an external event?,11152
Drawing Library for Ruby,11145
ASP.NET Caching,11141
How to run remote shell scripts from ASP pages?,11135
In C++/Windows how do I get the network name of the computer I'm on?,11127
Best Wiki for Mobile Users [closed],11112
What is the prefered style for single decision and action statements? [closed],11099
What is the best way to work around the fact that ALL Java bytes are signed?,11088
How can I determine the type of a blessed reference in Perl?,11085
How should I unit test a code-generator?,11060
How big would such a database be?,11055
Refresh Excel VBA Function Results,11045
SQL Table Aliases - Good or Bad? [closed],11043
What are the advantages of explicit Join Transitive Closure in SQL?,11028
MS Team Foundation Server in distributed environments - hints tips tricks needed,10999
What are the proper permissions for an upload folder with PHP/Apache?,10990
How to prevent an object being created on the heap?,10985
IKVM and Licensing,10980
Unit tests for deep cloning,10949
How to trace COM objects exceptions?,10935
Can you recommend a good .NET web-based repository browser for SVN? [closed],10933
Deleting / Replacing A Node in E4X (AS3 - Flex),10926
How do you measure SQL Fill Factor value,10919
Best way to model Many-To-One Relationships in NHibernate When Dealing With a Legacy DB?,10915
Can you use generic forms in C#?,10905
"Future proofing a large UI Application - MFC with 2008 Feature pack, or C# and Winforms?",10901
How to set up a DB2 linked server on a 64-bit SQL Server 2005?,10898
Best way to connect To Sql Server with MFC,10891
Any good advice on using emacs for C++ project? [closed],10880
How can you customize the numbers in an ordered list?,10877
How to encourage someone to learn programming? [closed],10872
"How can I ""unaccept"" a drag in Flex?",10870
Data Layer Best Practices,10860
LINQ query on a DataTable,10855
How to programmatically send SMS on the iPhone?,10848
Compare a date string to datetime in SQL Server?,10825
How to quickly test database access via a connection string,10822
"SQL, Auxiliary table of numbers",10819
"Why do I get the error ""Unable to update the password"" when calling AzMan?",10810
Ruby mixins and calling super methods,10808
Catching unhandled exceptions in ASP.NET UserControls,10793
Convert an asp.net application to IIS7 integrated mode,10782
What is the difference between integration and unit tests?,10752
