Question,ID
Visual Studio 2008 Training [closed],35614
What makes the Unix file system more superior to the Windows file system?,35599
Why does Python's iter() on a mapping return iterkeys() instead of iteritems()?,35569
Ruby On Rails on Windows with Mongrel,35564
How do I make bash reverse-search work in Terminal.app without it displaying garbled output?,35563
Lazy Loading with a WCF Service Domain Model?,35560
How far does SQL Server Express Edition scale?,35559
Excluding Code Analysis rule in source,35551
Make source with two targets,35548
"Are there any good programs for actionscript/flex that'll count lines of code, number of functions, files, packages,etc",35541
Validate (X)HTML in Python,35538
Zoom for a windows form in C#,35537
What Are High-Pass and Low-Pass Filters?,35530
canonical problems list,35528
looping and average in c++,35522
Changing default file structure in a Java Struts App,35507
Chat application AJAX polling,35499
Is there anyway to run Ruby on Rails applications on a Windows box?,35494
Mac OS X: What is the best way to estimate the code & static data size of program?,35491
Spread vs MPI vs zeromq?,35490
Fluid rounded corners with jQuery,35486
Linux: What is the best way to estimate the code & static data size of program?,35485
How can I clear Class::DBI's internal cache?,35480
Exception in Web Service locks DLL and prevents publishing. Workaround?,35479
How to divide two 64-bit numbers in Linux Kernel?,35463
How can I point Visual Studio 2008 to a new path for projects?,35432
"nmake, visualstudio, and .mak files",35429
How do I oversee my MySQL replication server?,35420
Trouble with parallel make not always starting another job when one finishes,35407
Encapsulate multiple properties at once using Resharper 4.0,35402
Print Odd-Even numbers using signals,35380
Internet Access in Ubuntu on VirtualBox [closed],35375
Best practices for signing .NET assemblies? [closed],35373
How can I change the way my Drupal theme displays the front page,35372
What are the main performance differences between varchar and nvarchar SQL Server data types?,35366
Minimalistic Database Administration,35357
Debug visualizer - the visualizer dll can't be loaded,35355
Russell's Paradox [closed],35339
Compiler Error C2143 when using a struct,35333
"Bypass Forms Authentication auto redirect to login, How to?",35322
How do you get the last record generated in a recursive CTE?,35320
Why does Vista complain about a dead process when I use Cygwin X11 ssh and how do I get it to shut up?,35317
How do you combine multiple result sets in SSRS?,35315
FlexUnit component testing patterns: use addAsync or manually initialize?,35304
What is the difference between the | and || or operators?,35301
Log files in massively distributed systems,35292
DOS filename escaping for use with *nix commands,35286
How do I restore files to previous states in git? [duplicate],35284
Managing multiple identical databases efficiently? [closed],35256
Large File Download,35248
