Question,ID
How do I tell Maven to use the latest version of a dependency?,30571
Resize transparent images using C#,30569
Delayed Write Failed on Windows 2003 Clustered Fileshare,30566
Returning the sum of items depending on which type it is,30563
Is code written in Vista 64 compatible on 32 bit os?,30543
Using MVP - How to use Events Properly for Testing,30541
What does this javascript error mean? Permission denied to call method to Location.toString,30540
Best way to enumerate all available video codecs on Windows?,30539
How to implement Type-safe COM enumerations?,30529
Qt Child Window Placement,30521
Display solution/file path in the Visual Studio IDE,30505
Programmatically retrieve Visual Studio install directory,30504
Compare Version Identifiers,30494
"What is a reasonable length limit on person ""Name"" fields?",30485
How to collect customer feedback? [closed],30465
Parsing XML Elements & Attributes with Perl,30454
Moving from Visual Studio 2005 to 2008 and .NET 2.0,30430
Experience with Java clustering?,30428
Dynamically display Edit Control Block menu item in SharePoint,30397
How do I replicate content on a web farm,30379
What C++ pitfalls should I avoid? [closed],30373
"When must I set a variable to ""Nothing"" in VB6?",30354
Fixed page layout in IE6,30346
Why do I receive a q[num] error when aborting a jQuery queue pipeline?,30342
Install-base of Java JRE?,30337
OCR with the Tesseract interface,30328
How to store Application Messages for a .NET Website,30321
Is there a HTML opposite to <noscript>?,30319
Where can I find a graphical command shell?,30318
Asp.Net MVC: How do I enable dashes in my urls?,30310
Why would getcwd() return a different directory than a local pwd?,30307
Asp.Net Routing: How do I ignore multiple wildcard routes?,30302
MS hotfix delayed delivery [closed],30297
Should you run one or multiple applications per tomcat cluster?,30295
How can you test to see if two arrays are the same using CFML?,30288
NullReferenceException on User Control handle,30286
How Popular is the Seam Framework,30281
Tables instead of DIVs [duplicate],30251
WPF setting a MenuItem.Icon in code,30239
enter key to insert newline in asp.net multiline textbox control,30230
SQL Server: Get data for only the past year,30222
Can Windows' built-in ZIP compression be scripted?,30211
TFS Lifecycle Management for Build Environment,30209
How can I format a javascript date to be serialized by jQuery,30188
Winforms - Click/drag anywhere in the form to move it as if clicked in the form caption [duplicate],30184
How do I enable Edit and Continue on a 64-bit application and VB2008 Express?,30183
Why won't .NET deserialize my primitive array from a web service?,30171
Avoiding repeated constants in CSS,30170
"How does WinXP's ""Send to Compressed (zipped) Folder"" decide what to include in zip file?",30152
Manual steps to upgrade VS.NET solution and target .NET framework?,30148
