Question,ID
Personalized icon next to the URL address in the browser's address bar?,10072
Compact Framework/Threading - MessageBox displays over other controls after option is chosen,10071
looking for a GPS with a good API [closed],10061
Removing icon from Windows title bars without ditching close button or system menu?,10059
.NET: How do I find the Desktop path when Folder Redirection is on?,10043
How do I create a Linked List Data Structure in Java? [closed],10042
"Animation in javascript, a starting point",10038
What is the easiest way to add compression to WCF in Silverlight?,10006
What do you look for from a User Group?,9977
Query times out from web app but runs fine from management studio,9974
Generic iterator,9938
What is a good way to open large files across a WAN?,9932
How to setup Groovy + Eclipse + Junit4?,9928
Analyzing Multithreaded Programs [closed],9926
Check for hung Office process when using Office Automation,9905
Looking for algorithm that reverses the sprintf() function output,9882
Personal Website Construction [closed],9877
"Performance critical GUI application (windows,linux)",9846
Developer Friendly ERP [closed],9836
Mootools: Drag & Drop problems,9831
Calculate DateTime Weeks into Rows,9805
Oracle XE or SQL Server Express,9783
Can I script FlexBuilder without writing an extension?,9769
Sending emails without looking like spam [duplicate],9751
How can I reverse the ON bits in a byte?,9750
What kind of servers did you virtualize lately?,9749
C#.Net case-insensitive string,9734
How to extend project properties page?,9729
How to prevent the mouse cursor from being hidden after calling CComboBox::ShowDropDown?,9704
Default database IDs; system and user values,9702
Visual Studio 2005 Macros stop working when Visual Studio 2008 is installed,9693
Need Pattern for dynamic search of multiple sql tables,9687
Document Server: Handling Concurrent Saves,9675
How do I remove duplicates from a C# array?,9673
Validating a Win32 Window Handle,9667
Is accessing a variable in C# an atomic operation?,9666
Lisp/Scheme interpreter without Emacs?,9650
WPF: How to style or disable the default ContextMenu of a TextBox,9632
"Playing wave file ends immediately (C++, Windows)",9629
Displaying vector graphics in a browser,9615
Bidirectional outer join,9614
Setting Group Type for new Active Directory Entry in VB.NET,9612
Visual Studio 2008 Window layout annoyance,9601
What WPF books would you recommend? [closed],9591
Is there a good tool for Makefile generation? [closed],9589
What libraries do I need to link my mixed-mode application to?,9570
How do you deploy your SharePoint solutions? [closed],9543
C# 2.0 code consuming assemblies compiled with C# 3.0,9508
Replicating load related crashes in non-production environments,9501
How do I make Visual Studio auto generate braces for a function block?,9486
