Question,ID
SQLStatement.execute() - multiple queries in one statement,80
Getting Subclipse in Aptana to work with the newest release of Subversion,79
How do I add existing comments to RDoc in Ruby? [closed],72
Paging a collection with LINQ,66
"Microsoft Office 2007 file type, Mime types and identifying characters",61
"How do I get a distinct, ordered list of names from a DataTable using LINQ?",59
Multiple submit buttons in an HTML form,48
Best way to allow plugins for a PHP application [closed],42
Reliable timer in a console application,39
Check for changes to an SQL Server table?,36
How to unload a ByteArray using Actionscript 3?,34
How to use the C socket API in C++ on z/OS,25
Throw an error preventing a table update in a MySQL trigger,24
What is the fastest way to get the value of π?,19
Binary Data in MySQL [closed],17
Filling a DataSet or a DataTable from a LINQ query result set,16
Difference between Math.Floor() and Math.Truncate(),14
Determine a user's timezone,13
Calculate relative time in C#,11
How do I calculate someone's age based on a DateTime type birthday?,9
Why did the width collapse in the percentage width child element in an absolutely positioned parent on Internet Explorer 7?,6
How to convert Decimal to Double in C#?,4
