Question,ID
Setting up an Erlang development environment,2742
Shell scripting input redirection oddities,2732
I need to know how much disk space a table is using in SQL Server,2714
"What sites offer free, quality web site design templates? [closed]",2711
How can you tell when a user last pressed a key (or moved the mouse)?,2709
How do I use T-SQL Group By,2702
What do I need to escape when sending a query?,2688
Getting started with Version Control System [closed],2658
What's the best way to determine if a temporary table exists in SQL Server?,2649
How do I split a delimited string so I can access individual items?,2647
What are some web-based knowledge-base solutions? [closed],2639
What are your favorite Powershell Cmdlets? [closed],2630
Appropriate Windows O/S pagefile size for SQL Server,2588
What is a good web-based Grid that accepts Excel clipboard data?,2563
What's the best online payment processing solution? [closed],2556
What are effective options for embedding video in an ASP.NET web site?,2550
What are the best solutions for flash charts and graphs? [closed],2543
Good STL-like library for C [closed],2540
How do you disable browser autocomplete on web form field / input tags?,2530
Find node clicked under context menu,2527
.NET obfuscation tools/strategy [closed],2525
"Visual Studio ""Unable to start debugging on the web server. The web server did not respond in a timely manner.""",2524
Using multiple SQLite databases at once,2518
What are the primary differences between TDD and BDD? [closed],2509
Auto Generate Database Diagram MySQL [closed],2488
What is Progressive Enhancement?,2486
Casting: (NewType) vs. Object as NewType [duplicate],2483
What are some good resources for learning threaded programming? [closed],2482
Best self-balancing BST for quick insertion of a large number of nodes,2481
How can I tell if a web client is blocking advertisements?,2472
Are there best practices for testing security in an Agile development shop? [closed],2447
Have you ever encountered a query that SQL Server could not execute because it referenced too many tables?,2432
Binary file layout reference [closed],2405
Read binary file into a struct,2384
Can anyone explain Monads? [duplicate],2366
How to tab focus onto a dropdown field in Mac OSX,2349
What is the best way to iterate through an array in Classic Asp VBScript?,2348
How do I turn on line numbers by default in TextWrangler on the Mac?,2332
Tracking state using ASP.NET AJAX / ICallbackEventHandler,2328
File size differences after copying a file to a server vía FTP,2311
ASP.NET Display SVN Revision Number,2308
How do I traverse a collection in classic ASP?,2300
Add Custom Tag to Visual Studio Validation,2279
How to filter and combine 2 datasets in C#,2267
ASP.NET URL Rewriting,2262
Mapping Stream data to data structures in C#,2256
Datatable vs Dataset,2250
How to call shell commands from Ruby,2232
How can I unit test Flex applications from within the IDE or a build script?,2222
What's the best way to implement BDD/TDD in .NET 2.0? [closed],2214
