Question,ID
"Filter by zip code, or other location based data retrieval strategies",12823
Anyone Using Executable Requirements?,12815
How to register COM from VS Setup project?,12807
How do I add a pre tag inside a code tag with jQuery?,12794
Attaching VisualSVN Server to an existing repository,12774
How is the HTML on this site so clean?,12768
Strange characters in PHP,12765
Add .NET 2.0 SP1 as a prerequisite for deployment project,12720
Setting up Subversion on Windows as a service,12718
Problems with #import of .NET out-of-proc server,12716
Load an XmlNodeList into an XmlDocument without looping?,12709
Best way to custom edit records in ASP.NET?,12706
Returning DataTables in WCF/.NET,12702
IronPython and ASP.NET,12692
How can I pass data from an aspx page to an ascx modal popup?,12671
Resources for getting started with web development? [closed],12669
Efficient JPEG Image Resizing in PHP,12661
Can I create a ListView with dynamic GroupItemCount?,12657
Variable parameter/result binding with prepared statements,12656
How do I tell if a variable has a numeric value in Perl?,12647
Upload binary data with Silverlight 2b2,12642
Building an auditing system; MS Access frontend on SQL Server backend,12638
What is the easiest way to parse an INI File in C++? [closed],12633
Specify a Port Number in Emacs sql-mysql,12613
"Access Control Lists & Access Control Objects, good tutorial?",12612
Designing a Calendar system like Google Calendar [closed],12611
Why was the Profile provider not built into Web Apps?,12603
Windows/C++: How do I determine the share name associated with a shared drive?,12594
Does System.Xml use MSXML?,12593
Can you check that an exception is thrown with doctest in Python?,12592
Using an XML catalog with Python's lxml?,12591
No trace info during processing of a cube in SSAS,12578
Rigor in capturing test cases for unit testing,12569
What do the different brackets in Ruby mean?,12565
What is your experience using the TIBCO General Interface? [closed],12556
How do you convert the number you get from datepart to the name of the day?,12533
Tools for automating mouse and keyboard events sent to a windows application,12523
Expression Evaluation and Tree Walking using polymorphism? (ala Steve Yegge),12516
Why Are People Still Creating RSS Feeds?,12509
PowerShell's Invoke-Expression missing param,12501
Pretty printing XML files on Emacs,12492
How do you get a directory listing in C?,12489
How can you publish a ClickOnce application through CruiseControl.NET?,12482
Why is my ASP.NET application throwing a ThreadAbortException? [closed],12476
Automate adding entries to a wiki,12428
Is it possible to slipstream the Visual Studio 2008 SP1 install?,12406
FOSS ASP.Net Session Replication Solution?,12401
.NET VirtualPathProviders and Pre-Compilation,12397
How to attach a ChangeEvent handler to an inherited dependency property?,12385
Has anyone had any success in unit testing SQL stored procedures?,12374
